caption,mean,precision,votes,not_funny,somewhat_funny,funny,cleaned_caption_v2,contest_id,tokens,occupations,topic
"Ghost runner to pinch hitter, two for the price of none.",1.0769230769230769,0.0333086693763245,65,60,5,0,ghost runner to pinch hitter two for the price of none,288,"['ghost', 'runner', 'to', 'pinch', 'hitter', 'two', 'for', 'the', 'price', 'of', 'none']",{'runner'},0
"I know you can't see it, but he's one of the best ghost runners out there.",1.0714285714285714,0.0347266024860284,56,52,4,0,i know you can not see it but he is one of the best ghost runners out there,288,"['i', 'know', 'you', 'can', 'not', 'see', 'it', 'but', 'he', 'is', 'one', 'of', 'the', 'best', 'ghost', 'runners', 'out', 'there']",{'runner'},0
"I know that ghost runners start the extra inning on second base already, but let him have this.",1.0689655172413792,0.033563052647744,58,54,4,0,i know that ghost runners start the extra inning on second base already but let him have this,288,"['i', 'know', 'that', 'ghost', 'runners', 'start', 'the', 'extra', 'inning', 'on', 'second', 'base', 'already', 'but', 'let', 'him', 'have', 'this']",{'runner'},0
"He's not much to look at, but he can sure stare down a pitcher.",1.0634920634920637,0.0309684598567075,63,59,4,0,he is not much to look at but he can sure stare down a pitcher,288,"['he', 'is', 'not', 'much', 'to', 'look', 'at', 'but', 'he', 'can', 'sure', 'stare', 'down', 'a', 'pitcher']",{'pitcher'},0
He scares the pitchers so much they just walk him.,1.0634920634920637,0.0309684598567075,63,59,4,0,he scares the pitchers so much they just walk him,288,"['he', 'scares', 'the', 'pitchers', 'so', 'much', 'they', 'just', 'walk', 'him']",{'pitcher'},0
Ghost runner? We have a whole ghost team.,1.0566037735849056,0.0320455764380545,53,50,3,0,ghost runner we have a whole ghost team,288,"['ghost', 'runner', 'we', 'have', 'a', 'whole', 'ghost', 'team']",{'runner'},0
Our catcher. Nobody will ever steal a sign from him.,1.0526315789473684,0.0298393005007284,57,54,3,0,our catcher nobody will ever steal a sign from him,288,"['our', 'catcher', 'nobody', 'will', 'ever', 'steal', 'a', 'sign', 'from', 'him']",{'catcher'},0
He’s an excellent pinch runner but stinks at batting.,1.0307692307692309,0.0215864849236958,65,63,2,0,he is an excellent pinch runner but stinks at batting,288,"['he', 'is', 'an', 'excellent', 'pinch', 'runner', 'but', 'stinks', 'at', 'batting']",{'runner'},0
You charlatan! You fool! You are death incarnate and yet you have never heard of the Immortal Game!? Have you never seen Blade Runner??,1.1728395061728396,0.0457790030067633,81,68,12,1,you charlatan you fool you are death incarnate and yet you have never heard of the immortal game have you never seen blade runner,289,"['you', 'charlatan', 'you', 'fool', 'you', 'are', 'death', 'incarnate', 'and', 'yet', 'you', 'have', 'never', 'heard', 'of', 'the', 'immortal', 'game', 'have', 'you', 'never', 'seen', 'blade', 'runner']",{'runner'},0
It gets 250 miles per pair of shoes. 300 if you wear cross trainers.,1.25,0.0641517899283383,68,54,11,3,it gets 250 miles per pair of shoes 300 if you wear cross trainers,291,"['it', 'gets', '250', 'miles', 'per', 'pair', 'of', 'shoes', '300', 'if', 'you', 'wear', 'cross', 'trainers']",{'trainer'},0
It’s a transitional car;  from skateboarder to grown up.,1.2359550561797752,0.0530540031455999,89,71,15,3,it is a transitional car from skateboarder to grown up,291,"['it', 'is', 'a', 'transitional', 'car', 'from', 'skateboarder', 'to', 'grown', 'up']",{'skateboarder'},0
And THIS is the new Peloton model. The coaches will motivate you through any commute!,1.225,0.0532934318037196,80,64,14,2,and this is the new peloton model the coaches will motivate you through any commute,291,"['and', 'this', 'is', 'the', 'new', 'peloton', 'model', 'the', 'coaches', 'will', 'motivate', 'you', 'through', 'any', 'commute']",{'coach'},0
It's for today's golfer who doesn't bring along clubs.,1.1978021978021978,0.0474496847317546,91,75,14,2,it is for today s golfer who does not bring along clubs,291,"['it', 'is', 'for', 'today', 's', 'golfer', 'who', 'does', 'not', 'bring', 'along', 'clubs']",{'golfer'},0
It was only used to bring in Little League relief pitchers.,1.1917808219178083,0.0503319810160926,73,60,12,1,it was only used to bring in little league relief pitchers,291,"['it', 'was', 'only', 'used', 'to', 'bring', 'in', 'little', 'league', 'relief', 'pitchers']",{'pitcher'},0
Urban golfers love this model ...very fuel efficient and easy to park !,1.1911764705882353,0.0524105196782898,68,56,11,1,urban golfers love this model very fuel efficient and easy to park,291,"['urban', 'golfers', 'love', 'this', 'model', 'very', 'fuel', 'efficient', 'and', 'easy', 'to', 'park']",{'golfer'},0
The horsepower isn’t great but it sure is an eye catcher.,1.1594202898550725,0.0570038676160413,69,61,5,3,the horsepower is not great but it sure is an eye catcher,291,"['the', 'horsepower', 'is', 'not', 'great', 'but', 'it', 'sure', 'is', 'an', 'eye', 'catcher']",{'catcher'},0
"For $10,000, this pre-owned LT is a sweet deal—0 emissions, no pedal, no metal, lots of headroom.  With our finance package we throw in a new pair of runners every 30,000 miles.",1.1518987341772151,0.0512378660834386,79,70,6,3,for 10 000 this pre owned lt is a sweet deal—0 emissions no pedal no metal lots of headroom with our finance package we throw in a new pair of runners every 30 000 miles,291,"['for', '10', '000', 'this', 'pre', 'owned', 'lt', 'is', 'a', 'sweet', 'deal—0', 'emissions', 'no', 'pedal', 'no', 'metal', 'lots', 'of', 'headroom', 'with', 'our', 'finance', 'package', 'we', 'throw', 'in', 'a', 'new', 'pair', 'of', 'runners', 'every', '30', '000', 'miles']",{'runner'},0
It’s a serious chick magnet if you are hoping to attract a marathon runner.,1.1228070175438596,0.043859649122807,57,50,7,0,it is a serious chick magnet if you are hoping to attract a marathon runner,291,"['it', 'is', 'a', 'serious', 'chick', 'magnet', 'if', 'you', 'are', 'hoping', 'to', 'attract', 'a', 'marathon', 'runner']",{'runner'},0
This model is a best seller amongst athletes who want to go green.,1.119047619047619,0.0428635170882864,84,76,6,2,this model is a best seller amongst athletes who want to go green,291,"['this', 'model', 'is', 'a', 'best', 'seller', 'amongst', 'athletes', 'who', 'want', 'to', 'go', 'green']","{'athlete', 'seller'}",0
"This little runner and your mid-life crisis a perfect match
Frank Buckley Andover MA",1.1025641025641026,0.0431437883915064,78,72,4,2,this little runner and your mid life crisis a perfect match frank buckley andover ma,291,"['this', 'little', 'runner', 'and', 'your', 'mid', 'life', 'crisis', 'a', 'perfect', 'match', 'frank', 'buckley', 'andover', 'ma']",{'runner'},0
This will also help offset any fuel expenses with money you make bringing relief pitchers out to the mound.,1.015384615384615,0.015504341823651,65,64,1,0,this will also help offset any fuel expenses with money you make bringing relief pitchers out to the mound,291,"['this', 'will', 'also', 'help', 'offset', 'any', 'fuel', 'expenses', 'with', 'money', 'you', 'make', 'bringing', 'relief', 'pitchers', 'out', 'to', 'the', 'mound']",{'pitcher'},0
Your abuse of power is a disgrace to all dog trainers.,1.2254901960784317,0.0519599601404217,102,84,13,5,your abuse of power is a disgrace to all dog trainers,292,"['your', 'abuse', 'of', 'power', 'is', 'a', 'disgrace', 'to', 'all', 'dog', 'trainers']",{'trainer'},0
"Like drummers in a rock band, many of Finn's predecessors met their demise too early in life.",1.1538461538461535,0.0589604219875226,65,58,4,3,like drummers in a rock band many of finn s predecessors met their demise too early in life,292,"['like', 'drummers', 'in', 'a', 'rock', 'band', 'many', 'of', 'finn', 's', 'predecessors', 'met', 'their', 'demise', 'too', 'early', 'in', 'life']",{'drummer'},1
"Swimmers in distress are all yours, damsels in distress are mine.",1.7241489023226215,0.0134400942720348,3143,1445,1120,578,swimmers in distress are all yours damsels in distress are mine,294,"['swimmers', 'in', 'distress', 'are', 'all', 'yours', 'damsels', 'in', 'distress', 'are', 'mine']",{'swimmer'},0
"I'm useless for rescuing swimmers, but the moment that dragon shows up ...",1.5075125208681135,0.0282425186813057,599,363,168,68,i am useless for rescuing swimmers but the moment that dragon shows up,294,"['i', 'am', 'useless', 'for', 'rescuing', 'swimmers', 'but', 'the', 'moment', 'that', 'dragon', 'shows', 'up']",{'swimmer'},0
You handle the swimmers; I'll take care of any dragons.,1.3931297709923665,0.0390933697949969,262,180,61,21,you handle the swimmers i will take care of any dragons,294,"['you', 'handle', 'the', 'swimmers', 'i', 'will', 'take', 'care', 'of', 'any', 'dragons']",{'swimmer'},0
You take care of the swimmers. I'm here to defend the castle.,1.37890625,0.0383973704017395,256,177,61,18,you take care of the swimmers i am here to defend the castle,294,"['you', 'take', 'care', 'of', 'the', 'swimmers', 'i', 'am', 'here', 'to', 'defend', 'the', 'castle']",{'swimmer'},0
You save the swimmers.  I'll guard the castle.,1.376068376068376,0.0408329111999576,234,164,52,18,you save the swimmers i will guard the castle,294,"['you', 'save', 'the', 'swimmers', 'i', 'will', 'guard', 'the', 'castle']","{'guard', 'swimmer'}",0
You rescue the swimmers. My job is defending the castle.,1.3567567567567569,0.0467680647635645,185,135,34,16,you rescue the swimmers my job is defending the castle,294,"['you', 'rescue', 'the', 'swimmers', 'my', 'job', 'is', 'defending', 'the', 'castle']",{'swimmer'},0
You save the swimmers. I'll save the Queen.,1.3315217391304348,0.0424850168245319,184,133,41,10,you save the swimmers i will save the queen,294,"['you', 'save', 'the', 'swimmers', 'i', 'will', 'save', 'the', 'queen']",{'swimmer'},0
Used to be that we would just let the crocs take care of the swimmers,1.3271604938271604,0.0478269819928778,162,121,29,12,used to be that we would just let the crocs take care of the swimmers,294,"['used', 'to', 'be', 'that', 'we', 'would', 'just', 'let', 'the', 'crocs', 'take', 'care', 'of', 'the', 'swimmers']",{'swimmer'},0
I guard against knight swimmers,1.325,0.048198684707647,160,120,28,12,i guard against knight swimmers,294,"['i', 'guard', 'against', 'knight', 'swimmers']","{'guard', 'swimmer'}",0
"Look, you save the swimmers, I'll guard the castle.",1.3223684210526316,0.0453501670461784,152,110,35,7,look you save the swimmers i will guard the castle,294,"['look', 'you', 'save', 'the', 'swimmers', 'i', 'will', 'guard', 'the', 'castle']","{'guard', 'swimmer'}",0
"You protect the swimmers, I'll guard the castle!",1.319277108433735,0.0427591270328951,166,120,39,7,you protect the swimmers i will guard the castle,294,"['you', 'protect', 'the', 'swimmers', 'i', 'will', 'guard', 'the', 'castle']","{'guard', 'swimmer'}",0
You rescue the swimmers; I’m guarding the castle.,1.3173652694610778,0.0416888100488597,167,120,41,6,you rescue the swimmers i am guarding the castle,294,"['you', 'rescue', 'the', 'swimmers', 'i', 'am', 'guarding', 'the', 'castle']",{'swimmer'},0
"Sure, you saved that swimmer, but I defended the entire castle.",1.3120567375886525,0.0484143210379461,141,105,28,8,sure you saved that swimmer but i defended the entire castle,294,"['sure', 'you', 'saved', 'that', 'swimmer', 'but', 'i', 'defended', 'the', 'entire', 'castle']",{'swimmer'},0
The poorer swimmers have learned not to go in the water on lifeguard medieval costume days.,1.2962962962962965,0.0427998776761337,162,121,34,7,the poorer swimmers have learned not to go in the water on lifeguard medieval costume days,294,"['the', 'poorer', 'swimmers', 'have', 'learned', 'not', 'to', 'go', 'in', 'the', 'water', 'on', 'lifeguard', 'medieval', 'costume', 'days']",{'swimmer'},0
"You take care of swimmers, and I’ll make sure nobody attacks the castle.",1.2949640287769784,0.04729491768549,139,105,27,7,you take care of swimmers and i will make sure nobody attacks the castle,294,"['you', 'take', 'care', 'of', 'swimmers', 'and', 'i', 'will', 'make', 'sure', 'nobody', 'attacks', 'the', 'castle']",{'swimmer'},0
"You save the swimmers, leave the siege to me.",1.2866666666666666,0.0436957824273562,150,113,31,6,you save the swimmers leave the siege to me,294,"['you', 'save', 'the', 'swimmers', 'leave', 'the', 'siege', 'to', 'me']",{'swimmer'},0
You'll have to rescue the swimmers---I'm here to defend the castle.,1.280373831775701,0.0493198181095679,107,80,24,3,you will have to rescue the swimmers i am here to defend the castle,294,"['you', 'will', 'have', 'to', 'rescue', 'the', 'swimmers', 'i', 'am', 'here', 'to', 'defend', 'the', 'castle']",{'swimmer'},0
"SURE,,, you protect all the swimmers,,, but I'm watching over an entire fortress,,,",1.28,0.0515564207071149,125,98,19,8,sure you protect all the swimmers but i am watching over an entire fortress,294,"['sure', 'you', 'protect', 'all', 'the', 'swimmers', 'but', 'i', 'am', 'watching', 'over', 'an', 'entire', 'fortress']",{'swimmer'},0
You keep an eye on on the swimmers.  I'll keep an eye out for someone storming the castle.,1.278688524590164,0.0497416371632746,122,94,22,6,you keep an eye on on the swimmers i will keep an eye out for someone storming the castle,294,"['you', 'keep', 'an', 'eye', 'on', 'on', 'the', 'swimmers', 'i', 'will', 'keep', 'an', 'eye', 'out', 'for', 'someone', 'storming', 'the', 'castle']",{'swimmer'},0
"Sinking swimmers might be your thing, but rising tide is mine.",1.2773722627737227,0.0471719844292735,137,106,24,7,sinking swimmers might be your thing but rising tide is mine,294,"['sinking', 'swimmers', 'might', 'be', 'your', 'thing', 'but', 'rising', 'tide', 'is', 'mine']",{'swimmer'},0
"With this lifeguard shortage, it was just easier for them to hire me to guard the water from swimmers.",1.2748091603053435,0.050891563897421,131,104,18,9,with this lifeguard shortage it was just easier for them to hire me to guard the water from swimmers,294,"['with', 'this', 'lifeguard', 'shortage', 'it', 'was', 'just', 'easier', 'for', 'them', 'to', 'hire', 'me', 'to', 'guard', 'the', 'water', 'from', 'swimmers']","{'guard', 'swimmer'}",0
This is required now because half the swimmers are armed with AR15s.,1.2698412698412698,0.0521447294969578,126,101,16,9,this is required now because half the swimmers are armed with ar15s,294,"['this', 'is', 'required', 'now', 'because', 'half', 'the', 'swimmers', 'are', 'armed', 'with', 'ar15s']",{'swimmer'},0
"You watch the swimmers, I’ll guard the castle.",1.2543859649122806,0.0428227056447274,114,86,27,1,you watch the swimmers i will guard the castle,294,"['you', 'watch', 'the', 'swimmers', 'i', 'will', 'guard', 'the', 'castle']","{'guard', 'swimmer'}",0
"You watch the swimmers, I've got your back if the Visigoths return.",1.2345679012345678,0.0534939852920822,81,64,15,2,you watch the swimmers i have got your back if the visigoths return,294,"['you', 'watch', 'the', 'swimmers', 'i', 'have', 'got', 'your', 'back', 'if', 'the', 'visigoths', 'return']",{'swimmer'},0
I’m weighed down with responsibilities; the swimmers are on you!,1.2293577981651376,0.0463280043044131,109,87,19,3,i am weighed down with responsibilities the swimmers are on you,294,"['i', 'am', 'weighed', 'down', 'with', 'responsibilities', 'the', 'swimmers', 'are', 'on', 'you']",{'swimmer'},0
"This would be great, if pigs weren't excellent swimmers.",1.225,0.0465361821220714,120,98,17,5,this would be great if pigs were not excellent swimmers,294,"['this', 'would', 'be', 'great', 'if', 'pigs', 'were', 'not', 'excellent', 'swimmers']",{'swimmer'},0
"If you'll do swimmer rescues, I'll handle dragon attacks.",1.2173913043478262,0.0432387093998997,92,72,20,0,if you will do swimmer rescues i will handle dragon attacks,294,"['if', 'you', 'will', 'do', 'swimmer', 'rescues', 'i', 'will', 'handle', 'dragon', 'attacks']",{'swimmer'},0
You get the swimmers; I protect the castle.,1.2117647058823529,0.0531740908220382,85,70,12,3,you get the swimmers i protect the castle,294,"['you', 'get', 'the', 'swimmers', 'i', 'protect', 'the', 'castle']",{'swimmer'},0
I don’t get many swimmers on the knight shift.,1.208695652173913,0.0453743681343006,115,95,16,4,i do not get many swimmers on the knight shift,294,"['i', 'do', 'not', 'get', 'many', 'swimmers', 'on', 'the', 'knight', 'shift']",{'swimmer'},0
Not all sperm are strong swimmers.,1.2,0.0512470743190538,100,85,10,5,not all sperm are strong swimmers,294,"['not', 'all', 'sperm', 'are', 'strong', 'swimmers']",{'swimmer'},0
Forget the swimmers.  Help defend my castle.,1.2,0.0483918603888994,80,65,14,1,forget the swimmers help defend my castle,294,"['forget', 'the', 'swimmers', 'help', 'defend', 'my', 'castle']",{'swimmer'},0
You rescue the swimmers in trouble; I’ll protect the castle.,1.1938775510204085,0.0473540662235426,98,82,13,3,you rescue the swimmers in trouble i will protect the castle,294,"['you', 'rescue', 'the', 'swimmers', 'in', 'trouble', 'i', 'will', 'protect', 'the', 'castle']",{'swimmer'},0
You think I could SWIM in this armor?  Not in my job description.  Just guarding the castle.  The swimmers are yours.,1.1910112359550562,0.0502201600716848,89,75,11,3,you think i could swim in this armor not in my job description just guarding the castle the swimmers are yours,294,"['you', 'think', 'i', 'could', 'swim', 'in', 'this', 'armor', 'not', 'in', 'my', 'job', 'description', 'just', 'guarding', 'the', 'castle', 'the', 'swimmers', 'are', 'yours']",{'swimmer'},0
"On second thought, maybe you help drowning swimmers and I'll handle the dragons.",1.1904761904761905,0.0470663900505225,105,89,12,4,on second thought maybe you help drowning swimmers and i will handle the dragons,294,"['on', 'second', 'thought', 'maybe', 'you', 'help', 'drowning', 'swimmers', 'and', 'i', 'will', 'handle', 'the', 'dragons']",{'swimmer'},0
I have sworn an oath to protect the castle.  You watch the swimmers.,1.1898734177215189,0.0511977581586359,79,66,11,2,i have sworn an oath to protect the castle you watch the swimmers,294,"['i', 'have', 'sworn', 'an', 'oath', 'to', 'protect', 'the', 'castle', 'you', 'watch', 'the', 'swimmers']",{'swimmer'},0
"You watch the swimmers, I'll watch for invaders crossing the moat.",1.1844660194174756,0.0452325943430408,103,87,13,3,you watch the swimmers i will watch for invaders crossing the moat,294,"['you', 'watch', 'the', 'swimmers', 'i', 'will', 'watch', 'for', 'invaders', 'crossing', 'the', 'moat']",{'swimmer'},0
You guard the swimmers and I'll guard the castle.  I can't swim in this trash.,1.181818181818182,0.0472478030910612,88,74,12,2,you guard the swimmers and i will guard the castle i can not swim in this trash,294,"['you', 'guard', 'the', 'swimmers', 'and', 'i', 'will', 'guard', 'the', 'castle', 'i', 'can', 'not', 'swim', 'in', 'this', 'trash']","{'guard', 'swimmer'}",0
You protect swimmers and I'll protect the castle.,1.180722891566265,0.0489219013145031,83,70,11,2,you protect swimmers and i will protect the castle,294,"['you', 'protect', 'swimmers', 'and', 'i', 'will', 'protect', 'the', 'castle']",{'swimmer'},0
"They asked me to be on the lookout for knight swimmers.""",1.1772151898734178,0.0432360791812641,79,65,14,0,they asked me to be on the lookout for knight swimmers,294,"['they', 'asked', 'me', 'to', 'be', 'on', 'the', 'lookout', 'for', 'knight', 'swimmers']","{'lookout', 'swimmer'}",0
You take care of the swimmers while I guard the castle.,1.1710526315789471,0.0434808201101534,76,63,13,0,you take care of the swimmers while i guard the castle,294,"['you', 'take', 'care', 'of', 'the', 'swimmers', 'while', 'i', 'guard', 'the', 'castle']","{'guard', 'swimmer'}",0
I'll guard the castle if you rescue the drowning swimmers.,1.1702127659574468,0.0444553142500922,94,80,12,2,i will guard the castle if you rescue the drowning swimmers,294,"['i', 'will', 'guard', 'the', 'castle', 'if', 'you', 'rescue', 'the', 'drowning', 'swimmers']","{'guard', 'swimmer'}",0
"You see swimmers, I see damsels.",1.1686746987951808,0.0447649593913974,83,70,12,1,you see swimmers i see damsels,294,"['you', 'see', 'swimmers', 'i', 'see', 'damsels']",{'swimmer'},0
You can defend the swimmers. I'm defending the castle!,1.162790697674419,0.0463746272326316,86,74,10,2,you can defend the swimmers i am defending the castle,294,"['you', 'can', 'defend', 'the', 'swimmers', 'i', 'am', 'defending', 'the', 'castle']",{'swimmer'},0
You go save the swimmers.  I'll handle the sharks.,1.160919540229885,0.039623877256794,87,73,14,0,you go save the swimmers i will handle the sharks,294,"['you', 'go', 'save', 'the', 'swimmers', 'i', 'will', 'handle', 'the', 'sharks']",{'swimmer'},0
You rescue the swimmers. I'll hold the fortress.,1.160493827160494,0.0479737264882109,81,70,9,2,you rescue the swimmers i will hold the fortress,294,"['you', 'rescue', 'the', 'swimmers', 'i', 'will', 'hold', 'the', 'fortress']",{'swimmer'},0
"It doesn't distract from struggling swimmers,  like when I used to build castles in the air.",1.1573033707865168,0.0388117572869526,89,75,14,0,it does not distract from struggling swimmers like when i used to build castles in the air,294,"['it', 'does', 'not', 'distract', 'from', 'struggling', 'swimmers', 'like', 'when', 'i', 'used', 'to', 'build', 'castles', 'in', 'the', 'air']",{'swimmer'},0
You take care of the swimmers; I'll take care of the insurrectionists.,1.1566265060240963,0.0436436553063486,83,71,11,1,you take care of the swimmers i will take care of the insurrectionists,294,"['you', 'take', 'care', 'of', 'the', 'swimmers', 'i', 'will', 'take', 'care', 'of', 'the', 'insurrectionists']",{'swimmer'},0
"You watch the swimmers, I'll protect the castle.",1.155844155844156,0.0455277215879749,77,66,10,1,you watch the swimmers i will protect the castle,294,"['you', 'watch', 'the', 'swimmers', 'i', 'will', 'protect', 'the', 'castle']",{'swimmer'},0
I'll keep an eye out for struggling swimmers if you'll keep an eye out for tiny sea marauders.,1.15,0.0439360870678698,80,69,10,1,i will keep an eye out for struggling swimmers if you will keep an eye out for tiny sea marauders,294,"['i', 'will', 'keep', 'an', 'eye', 'out', 'for', 'struggling', 'swimmers', 'if', 'you', 'will', 'keep', 'an', 'eye', 'out', 'for', 'tiny', 'sea', 'marauders']",{'swimmer'},0
You guard uninteresting swimmers.  I guard interesting castles.,1.136842105263158,0.0384775390503995,95,83,11,1,you guard uninteresting swimmers i guard interesting castles,294,"['you', 'guard', 'uninteresting', 'swimmers', 'i', 'guard', 'interesting', 'castles']","{'guard', 'swimmer'}",0
"Sure, a good moat will keep most intruders out, but you’ll need another line of defense when the attacker happens to be a very determined swimmer …",1.1318681318681318,0.0447726346977216,91,82,6,3,sure a good moat will keep most intruders out but you will need another line of defense when the attacker happens to be a very determined swimmer …,294,"['sure', 'a', 'good', 'moat', 'will', 'keep', 'most', 'intruders', 'out', 'but', 'you', 'will', 'need', 'another', 'line', 'of', 'defense', 'when', 'the', 'attacker', 'happens', 'to', 'be', 'a', 'very', 'determined', 'swimmer', '…']",{'swimmer'},0
"You gaurd the swimmers, I'll gaurd the swimmers.",1.1232876712328768,0.0387455770513176,73,64,9,0,you gaurd the swimmers i will gaurd the swimmers,294,"['you', 'gaurd', 'the', 'swimmers', 'i', 'will', 'gaurd', 'the', 'swimmers']",{'swimmer'},0
"Doesn’t hold up great in salt water and a bit heavy to swim in BUT I can protect the castle, harpoon sharks and save the swimmer!",1.1129032258064515,0.046591027055115,62,56,5,1,does not hold up great in salt water and a bit heavy to swim in but i can protect the castle harpoon sharks and save the swimmer,294,"['does', 'not', 'hold', 'up', 'great', 'in', 'salt', 'water', 'and', 'a', 'bit', 'heavy', 'to', 'swim', 'in', 'but', 'i', 'can', 'protect', 'the', 'castle', 'harpoon', 'sharks', 'and', 'save', 'the', 'swimmer']",{'swimmer'},0
"You watch the swimmers, I've got this.",1.1097560975609757,0.0459307622132202,82,76,3,3,you watch the swimmers i have got this,294,"['you', 'watch', 'the', 'swimmers', 'i', 'have', 'got', 'this']",{'swimmer'},0
"You take care of  the distressed swimmers, I’ll defend the castle.",1.105263157894737,0.0442439305716437,76,70,4,2,you take care of the distressed swimmers i will defend the castle,294,"['you', 'take', 'care', 'of', 'the', 'distressed', 'swimmers', 'i', 'will', 'defend', 'the', 'castle']",{'swimmer'},0
"Swimmers are not permitted to float in my moat.""

""We need to move on to bigger and better things.",1.1025641025641026,0.0390945794678847,78,71,6,1,swimmers are not permitted to float in my moat we need to move on to bigger and better things,294,"['swimmers', 'are', 'not', 'permitted', 'to', 'float', 'in', 'my', 'moat', 'we', 'need', 'to', 'move', 'on', 'to', 'bigger', 'and', 'better', 'things']",{'swimmer'},0
You watch the swimmers. I'll watch the castle.,1.101123595505618,0.0321391884015368,89,80,9,0,you watch the swimmers i will watch the castle,294,"['you', 'watch', 'the', 'swimmers', 'i', 'will', 'watch', 'the', 'castle']",{'swimmer'},0
"You're just enabling poor swimmers, I'm defending civilization against natural forces.",1.0921052631578947,0.0382862330575354,76,70,5,1,you are just enabling poor swimmers i am defending civilization against natural forces,294,"['you', 'are', 'just', 'enabling', 'poor', 'swimmers', 'i', 'am', 'defending', 'civilization', 'against', 'natural', 'forces']",{'swimmer'},0
Irresponsible swimmers really get my moat,1.0864197530864197,0.0314148411111098,81,74,7,0,irresponsible swimmers really get my moat,294,"['irresponsible', 'swimmers', 'really', 'get', 'my', 'moat']",{'swimmer'},0
