caption,mean,precision,votes,not_funny,somewhat_funny,funny,cleaned_caption_v2,contest_id,tokens,occupations,topic
"...then I realized I wasn't that crazy about marching anyway, so--different schmifferent--I fired the drummer.",1.0,0.1178511301977579,9,9,0,0,then i realized i was not that crazy about marching anyway so different schmifferent i fired the drummer,0,"['then', 'i', 'realized', 'i', 'was', 'not', 'that', 'crazy', 'about', 'marching', 'anyway', 'so', 'different', 'schmifferent', 'i', 'fired', 'the', 'drummer']",{'drummer'},1
Pitchers and catchers report ...,1.0,0.1543033499620919,7,7,0,0,pitchers and catchers report,1,"['pitchers', 'and', 'catchers', 'report']","{'pitcher', 'catcher'}",0
Runners are in the next studio on your left.,1.2,0.2236067977499789,5,4,1,0,runners are in the next studio on your left,2,"['runners', 'are', 'in', 'the', 'next', 'studio', 'on', 'your', 'left']",{'runner'},0
We do tend to be flexible but not when it comes to runners.,1.0,0.2886751345948128,4,4,0,0,we do tend to be flexible but not when it comes to runners,2,"['we', 'do', 'tend', 'to', 'be', 'flexible', 'but', 'not', 'when', 'it', 'comes', 'to', 'runners']",{'runner'},0
"Sorry for asking sweetie, but I just can't tell the pitchers from catchers anymore.",1.0,0.1336306209562122,8,8,0,0,sorry for asking sweetie but i just can not tell the pitchers from catchers anymore,2,"['sorry', 'for', 'asking', 'sweetie', 'but', 'i', 'just', 'can', 'not', 'tell', 'the', 'pitchers', 'from', 'catchers', 'anymore']","{'pitcher', 'catcher'}",0
"In yoga we use mats -- not runners, neither floor nor designated.",1.0,0.2886751345948128,4,4,0,0,in yoga we use mats not runners neither floor nor designated,2,"['in', 'yoga', 'we', 'use', 'mats', 'not', 'runners', 'neither', 'floor', 'nor', 'designated']",{'runner'},0
I think you're more of a runner than a yogi.,1.0,0.2886751345948128,4,4,0,0,i think you are more of a runner than a yogi,2,"['i', 'think', 'you', 'are', 'more', 'of', 'a', 'runner', 'than', 'a', 'yogi']",{'runner'},0
I said I'm attracted to fit Asians; not Oriental runners.,1.0,0.2886751345948128,4,4,0,0,i said i am attracted to fit asians not oriental runners,2,"['i', 'said', 'i', 'am', 'attracted', 'to', 'fit', 'asians', 'not', 'oriental', 'runners']",{'runner'},0
"Runners Beyond Hope isn't a class per se, it's more of a gathering across the hall with a big mirror.",1.0,0.2886751345948128,4,4,0,0,runners beyond hope is not a class per se it is more of a gathering across the hall with a big mirror,2,"['runners', 'beyond', 'hope', 'is', 'not', 'a', 'class', 'per', 'se', 'it', 'is', 'more', 'of', 'a', 'gathering', 'across', 'the', 'hall', 'with', 'a', 'big', 'mirror']",{'runner'},0
"Gear may BE overrated, but really!--the lobby runner?",1.0,0.2886751345948128,4,4,0,0,gear may be overrated but really the lobby runner,2,"['gear', 'may', 'be', 'overrated', 'but', 'really', 'the', 'lobby', 'runner']",{'runner'},0
Of course the drummer is conservative.,1.0,0.408248290463863,3,3,0,0,of course the drummer is conservative,3,"['of', 'course', 'the', 'drummer', 'is', 'conservative']",{'drummer'},1
"They don't know it but I wax on their runners ,we will just hit the breaks and they will sail right by!",1.4482758620689655,0.1172993192097601,29,18,9,2,they do not know it but i wax on their runners we will just hit the breaks and they will sail right by,4,"['they', 'do', 'not', 'know', 'it', 'but', 'i', 'wax', 'on', 'their', 'runners', 'we', 'will', 'just', 'hit', 'the', 'breaks', 'and', 'they', 'will', 'sail', 'right', 'by']",{'runner'},0
I thought I told you to grease the runners before we hit that bank!,1.263157894736842,0.1037908733877125,19,14,5,0,i thought i told you to grease the runners before we hit that bank,4,"['i', 'thought', 'i', 'told', 'you', 'to', 'grease', 'the', 'runners', 'before', 'we', 'hit', 'that', 'bank']",{'runner'},0
I knew we should've waxed our runners more,1.1764705882352942,0.0953050102707037,17,14,3,0,i knew we should have waxed our runners more,4,"['i', 'knew', 'we', 'should', 'have', 'waxed', 'our', 'runners', 'more']",{'runner'},0
Wait till Dad finds out you've been greasing the runners with his hair cream again.,1.1176470588235294,0.0805474349272303,17,15,2,0,wait till dad finds out you have been greasing the runners with his hair cream again,4,"['wait', 'till', 'dad', 'finds', 'out', 'you', 'have', 'been', 'greasing', 'the', 'runners', 'with', 'his', 'hair', 'cream', 'again']",{'runner'},0
The sheriff's new model is quite the runner.,1.0625,0.0645497224367902,16,15,1,0,the sheriff s new model is quite the runner,4,"['the', 'sheriff', 's', 'new', 'model', 'is', 'quite', 'the', 'runner']",{'runner'},0
"Not to brag, but I was a runner up for a Darwin Award last year.",1.6666666666666667,0.2357022603955158,9,4,4,1,not to brag but i was a runner up for a darwin award last year,5,"['not', 'to', 'brag', 'but', 'i', 'was', 'a', 'runner', 'up', 'for', 'a', 'darwin', 'award', 'last', 'year']",{'runner'},0
"Wow, the cow-catcher does make a difference!",1.0,0.2886751345948128,4,4,0,0,wow the cow catcher does make a difference,5,"['wow', 'the', 'cow', 'catcher', 'does', 'make', 'a', 'difference']",{'catcher'},0
Who knew the Road Runner Diner would be so realistic?,1.4,0.3999999999999999,5,4,0,1,who knew the road runner diner would be so realistic,6,"['who', 'knew', 'the', 'road', 'runner', 'diner', 'would', 'be', 'so', 'realistic']",{'runner'},0
My life feels like a Road Runner cartoon.,1.25,0.2886751345948128,4,3,1,0,my life feels like a road runner cartoon,6,"['my', 'life', 'feels', 'like', 'a', 'road', 'runner', 'cartoon']",{'runner'},0
"I tell ya, I can feel it, Chuck. Today's the day I'm gonna catch that Road Runner.",1.25,0.2886751345948128,4,3,1,0,i tell ya i can feel it chuck today s the day i am going to catch that road runner,6,"['i', 'tell', 'ya', 'i', 'can', 'feel', 'it', 'chuck', 'today', 's', 'the', 'day', 'i', 'am', 'going', 'to', 'catch', 'that', 'road', 'runner']",{'runner'},0
Almost ran over an actual Road Runner with my car on a business trip to Arizona last week. Those things are fast.,1.0,0.408248290463863,3,3,0,0,almost ran over an actual road runner with my car on a business trip to arizona last week those things are fast,6,"['almost', 'ran', 'over', 'an', 'actual', 'road', 'runner', 'with', 'my', 'car', 'on', 'a', 'business', 'trip', 'to', 'arizona', 'last', 'week', 'those', 'things', 'are', 'fast']",{'runner'},0
It's the last of the Republican front runners.,1.3953488372093024,0.1006046772739316,43,30,9,4,it is the last of the republican front runners,8,"['it', 'is', 'the', 'last', 'of', 'the', 'republican', 'front', 'runners']",{'runner'},0
He was once a Republican front runner until Trump came along.,1.3529411764705883,0.1023986211504105,34,24,8,2,he was once a republican front runner until trump came along,8,"['he', 'was', 'once', 'a', 'republican', 'front', 'runner', 'until', 'trump', 'came', 'along']",{'runner'},0
Sand traps can be confusing for the non-golfer.,1.3243243243243243,0.1099689695111144,37,29,4,4,sand traps can be confusing for the non golfer,8,"['sand', 'traps', 'can', 'be', 'confusing', 'for', 'the', 'non', 'golfer']",{'golfer'},0
"If we want the it back, ask mom for a pitcher of margaritas.",1.173913043478261,0.1023860383161155,23,20,2,1,if we want the it back ask mom for a pitcher of margaritas,8,"['if', 'we', 'want', 'the', 'it', 'back', 'ask', 'mom', 'for', 'a', 'pitcher', 'of', 'margaritas']",{'pitcher'},0
he's the show runner for Survivor,1.0833333333333333,0.0833333333333333,24,23,0,1,he is the show runner for survivor,8,"['he', 'is', 'the', 'show', 'runner', 'for', 'survivor']",{'runner'},0
"Yeah, that's the guy, Neddy Merrill, the swimmer. I told him swimming home was a bad idea.",1.0555555555555556,0.0571661950475029,18,17,1,0,yeah that is the guy neddy merrill the swimmer i told him swimming home was a bad idea,8,"['yeah', 'that', 'is', 'the', 'guy', 'neddy', 'merrill', 'the', 'swimmer', 'i', 'told', 'him', 'swimming', 'home', 'was', 'a', 'bad', 'idea']",{'swimmer'},0
Those other ones are for mini golfers.,1.2857142857142858,0.0854428532299629,42,32,8,2,those other ones are for mini golfers,11,"['those', 'other', 'ones', 'are', 'for', 'mini', 'golfers']",{'golfer'},0
This was the consolation prize I received for being runner up at my last golf tournament.,1.1363636363636365,0.0748867700952649,22,19,3,0,this was the consolation prize i received for being runner up at my last golf tournament,11,"['this', 'was', 'the', 'consolation', 'prize', 'i', 'received', 'for', 'being', 'runner', 'up', 'at', 'my', 'last', 'golf', 'tournament']",{'runner'},0
"Big umbrella, bad golfer.",1.12,0.066332495807108,25,22,3,0,big umbrella bad golfer,11,"['big', 'umbrella', 'bad', 'golfer']",{'golfer'},0
"I call it the ""Katrina Catcher"".",1.0952380952380951,0.0952380952380952,21,20,0,1,i call it the katrina catcher,11,"['i', 'call', 'it', 'the', 'katrina', 'catcher']",{'catcher'},0
The twelfth one is their parties front runner for President.,1.146341463414634,0.0558850694506809,41,35,6,0,the twelfth one is their parties front runner for president,13,"['the', 'twelfth', 'one', 'is', 'their', 'parties', 'front', 'runner', 'for', 'president']","{'president', 'runner'}",0
"I'd heard the rumors about Russian athletes taking performance-enhancing substances, but I thought fencing would be clean.",1.09375,0.0523514603733821,32,29,3,0,i would heard the rumors about russian athletes taking performance enhancing substances but i thought fencing would be clean,14,"['i', 'would', 'heard', 'the', 'rumors', 'about', 'russian', 'athletes', 'taking', 'performance', 'enhancing', 'substances', 'but', 'i', 'thought', 'fencing', 'would', 'be', 'clean']",{'athlete'},0
"I know...I know... it looks ridiculous, but the only size left was Republican Front Runner.",1.2244897959183674,0.0669126380030816,49,39,9,1,i know i know it looks ridiculous but the only size left was republican front runner,15,"['i', 'know', 'i', 'know', 'it', 'looks', 'ridiculous', 'but', 'the', 'only', 'size', 'left', 'was', 'republican', 'front', 'runner']",{'runner'},0
"Hi! If you can use a pitcher with a 250 mph fastball, I'm your guy.",1.3220338983050848,0.0781158828596312,59,44,11,4,hi if you can use a pitcher with a 250 mph fastball i am your guy,16,"['hi', 'if', 'you', 'can', 'use', 'a', 'pitcher', 'with', 'a', '250', 'mph', 'fastball', 'i', 'am', 'your', 'guy']",{'pitcher'},0
I got hooked on Road Runner cartoons.,1.2962962962962965,0.0776562226070417,54,41,10,3,i got hooked on road runner cartoons,18,"['i', 'got', 'hooked', 'on', 'road', 'runner', 'cartoons']",{'runner'},0
...and that's when Bob became the first amateur drone catcher.,1.1025641025641026,0.0492161471762765,39,35,4,0,and that is when bob became the first amateur drone catcher,18,"['and', 'that', 'is', 'when', 'bob', 'became', 'the', 'first', 'amateur', 'drone', 'catcher']",{'catcher'},0
"The ropemaker went to the Bahamas because winter aggravates his gout, and the rat-catcher is passed out from the ale at the feast.",1.1224489795918366,0.0555786892461502,49,44,4,1,the ropemaker went to the bahamas because winter aggravates his gout and the rat catcher is passed out from the ale at the feast,19,"['the', 'ropemaker', 'went', 'to', 'the', 'bahamas', 'because', 'winter', 'aggravates', 'his', 'gout', 'and', 'the', 'rat', 'catcher', 'is', 'passed', 'out', 'from', 'the', 'ale', 'at', 'the', 'feast']",{'catcher'},0
The Prince will attend with four score drummers.,1.022222222222222,0.0224733287487747,45,44,1,0,the prince will attend with four score drummers,19,"['the', 'prince', 'will', 'attend', 'with', 'four', 'score', 'drummers']",{'drummer'},1
"I'm your Uber diver, Moby.",1.2045454545454546,0.0426654111411806,132,110,17,5,i am your uber diver moby,21,"['i', 'am', 'your', 'uber', 'diver', 'moby']",{'diver'},0
I'm just following the guidelines for athletes sailing in Rio 2016.,1.053763440860215,0.0280485428651927,93,89,3,1,i am just following the guidelines for athletes sailing in rio 2016,21,"['i', 'am', 'just', 'following', 'the', 'guidelines', 'for', 'athletes', 'sailing', 'in', 'rio', '2016']",{'athlete'},0
"No, Ma'am, I'm sorry, the bucket drummers don't come on until rush hour.",1.405940594059406,0.0647588333693775,101,69,23,9,no madam i am sorry the bucket drummers do not come on until rush hour,22,"['no', 'madam', 'i', 'am', 'sorry', 'the', 'bucket', 'drummers', 'do', 'not', 'come', 'on', 'until', 'rush', 'hour']",{'drummer'},1
Anything good from the cow catcher?,1.208955223880597,0.0500443649074902,67,53,14,0,anything good from the cow catcher,22,"['anything', 'good', 'from', 'the', 'cow', 'catcher']",{'catcher'},0
Today we have a cow catcher steak special.,1.196969696969697,0.0580157400461186,66,55,9,2,today we have a cow catcher steak special,22,"['today', 'we', 'have', 'a', 'cow', 'catcher', 'steak', 'special']",{'catcher'},0
May I suggest starting with ear plugs and a pitcher of our house moonshine?,1.1875,0.0539832057952888,64,53,10,1,may i suggest starting with ear plugs and a pitcher of our house moonshine,22,"['may', 'i', 'suggest', 'starting', 'with', 'ear', 'plugs', 'and', 'a', 'pitcher', 'of', 'our', 'house', 'moonshine']",{'pitcher'},0
"May I suggest the ""cow catcher surprise""?",1.0925925925925926,0.054615858928373,54,51,1,2,may i suggest the cow catcher surprise,22,"['may', 'i', 'suggest', 'the', 'cow', 'catcher', 'surprise']",{'catcher'},0
I'm not sure Brazil will believe we extradited the right swimmer...,1.3416666666666666,0.0585729372855721,120,90,19,11,i am not sure brazil will believe we extradited the right swimmer,23,"['i', 'am', 'not', 'sure', 'brazil', 'will', 'believe', 'we', 'extradited', 'the', 'right', 'swimmer']",{'swimmer'},0
No more Olympic swimmers!,1.1216216216216215,0.0469455903117995,74,67,5,2,no more olympic swimmers,23,"['no', 'more', 'olympic', 'swimmers']",{'swimmer'},0
No one likes a backseat diver.,1.3461538461538465,0.057598878792634,104,74,24,6,no one likes a backseat diver,24,"['no', 'one', 'likes', 'a', 'backseat', 'diver']",{'diver'},0
"Nobody likes a back seat diver, Frank",1.255813953488372,0.0622998497222199,86,70,10,6,nobody likes a back seat diver frank,24,"['nobody', 'likes', 'a', 'back', 'seat', 'diver', 'frank']",{'diver'},0
"Sperm whale donor, Honey. We know he's a good swimmer!",1.2528735632183907,0.0571495943170743,87,69,14,4,sperm whale donor honey we know he is a good swimmer,24,"['sperm', 'whale', 'donor', 'honey', 'we', 'know', 'he', 'is', 'a', 'good', 'swimmer']",{'swimmer'},0
"Steve, stop being a back seat diver!",1.2222222222222223,0.058267158231675,81,67,10,4,steve stop being a back seat diver,24,"['steve', 'stop', 'being', 'a', 'back', 'seat', 'diver']",{'diver'},0
Worst back seat diver ever.,1.2151898734177216,0.0560256991037279,79,65,11,3,worst back seat diver ever,24,"['worst', 'back', 'seat', 'diver', 'ever']",{'diver'},0
I warned you he's a back seat diver.,1.1866666666666668,0.0526533225197838,75,63,10,2,i warned you he is a back seat diver,24,"['i', 'warned', 'you', 'he', 'is', 'a', 'back', 'seat', 'diver']",{'diver'},0
"I know, back seat divers are so annoying.",1.178082191780822,0.0491265634505708,73,61,11,1,i know back seat divers are so annoying,24,"['i', 'know', 'back', 'seat', 'divers', 'are', 'so', 'annoying']",{'diver'},0
Not back seat diver...back seat driver!,1.1571428571428573,0.0483076505723,70,60,9,1,not back seat diver back seat driver,24,"['not', 'back', 'seat', 'diver', 'back', 'seat', 'driver']","{'diver', 'driver'}",0
Nothing worse than a backseat diver.,1.1571428571428573,0.0524185823803322,70,61,7,2,nothing worse than a backseat diver,24,"['nothing', 'worse', 'than', 'a', 'backseat', 'diver']",{'diver'},0
I've never liked a backseat diver.,1.144927536231884,0.0474200647405741,69,60,8,1,i have never liked a backseat diver,24,"['i', 'have', 'never', 'liked', 'a', 'backseat', 'diver']",{'diver'},0
Got a breath mint for the back seat diver?,1.144927536231884,0.0474200647405741,69,60,8,1,got a breath mint for the back seat diver,24,"['got', 'a', 'breath', 'mint', 'for', 'the', 'back', 'seat', 'diver']",{'diver'},0
I'm trying my best to ignore the backseat diver!,1.144927536231884,0.0474200647405741,69,60,8,1,i am trying my best to ignore the backseat diver,24,"['i', 'am', 'trying', 'my', 'best', 'to', 'ignore', 'the', 'backseat', 'diver']",{'diver'},0
"I don't want to be a backseat diver, but...",1.1428571428571428,0.0467835608690013,70,61,8,1,i do not want to be a backseat diver but,24,"['i', 'do', 'not', 'want', 'to', 'be', 'a', 'backseat', 'diver', 'but']",{'diver'},0
Bob hated having a backseat diver.,1.121212121212121,0.0458799056377558,66,59,6,1,bob hated having a backseat diver,24,"['bob', 'hated', 'having', 'a', 'backseat', 'diver']",{'diver'},0
Nobody likes a back-seat diver.,1.121212121212121,0.0458799056377558,66,59,6,1,nobody likes a back seat diver,24,"['nobody', 'likes', 'a', 'back', 'seat', 'diver']",{'diver'},0
Stan is the worst backseat diver.,1.1194029850746268,0.0499768741621393,67,61,4,2,stan is the worst backseat diver,24,"['stan', 'is', 'the', 'worst', 'backseat', 'diver']",{'diver'},0
Backseat diver.,1.109375,0.0393220543503684,64,57,7,0,backseat diver,24,"['backseat', 'diver']",{'diver'},0
If you get all up in his krill he becomes a bit of a backseat diver.,1.109375,0.0451913233305363,64,58,5,1,if you get all up in his krill he becomes a bit of a backseat diver,24,"['if', 'you', 'get', 'all', 'up', 'in', 'his', 'krill', 'he', 'becomes', 'a', 'bit', 'of', 'a', 'backseat', 'diver']",{'diver'},0
Do you mind me being a backseat diver?,1.0819672131147542,0.0354138835978571,61,56,5,0,do you mind me being a backseat diver,24,"['do', 'you', 'mind', 'me', 'being', 'a', 'backseat', 'diver']",{'diver'},0
"So you want to be an Uber driver who picks up scuba divers? I don't think this was your best idea, hun.",1.0677966101694916,0.0409159219712148,59,56,2,1,so you want to be an uber driver who picks up scuba divers i do not think this was your best idea hun,24,"['so', 'you', 'want', 'to', 'be', 'an', 'uber', 'driver', 'who', 'picks', 'up', 'scuba', 'divers', 'i', 'do', 'not', 'think', 'this', 'was', 'your', 'best', 'idea', 'hun']","{'driver', 'diver'}",0
(You) sense divers're searching for Mysticeti?,1.0,0.0190484829439864,53,53,0,0,you sense divers re searching for mysticeti,24,"['you', 'sense', 'divers', 're', 'searching', 'for', 'mysticeti']",{'diver'},0
"You know, sometimes that ""different drummer"" is just a bad musician.",1.418848167539267,0.0470959184337472,191,128,46,17,you know sometimes that different drummer is just a bad musician,28,"['you', 'know', 'sometimes', 'that', 'different', 'drummer', 'is', 'just', 'a', 'bad', 'musician']",{'drummer'},1
What drummer? I don't hear any drummer.,1.3503184713375795,0.0502047433349169,157,115,29,13,what drummer i do not hear any drummer,28,"['what', 'drummer', 'i', 'do', 'not', 'hear', 'any', 'drummer']",{'drummer'},1
I never hear that drummer.,1.3333333333333333,0.0523853102577231,150,114,22,14,i never hear that drummer,28,"['i', 'never', 'hear', 'that', 'drummer']",{'drummer'},1
He's always marched to a different drummer.,1.2580645161290325,0.0470350485937347,124,97,22,5,he is always marched to a different drummer,28,"['he', 'is', 'always', 'marched', 'to', 'a', 'different', 'drummer']",{'drummer'},1
He's been watching too many Road Runner cartoons.,1.2479338842975207,0.0487883376632907,121,97,18,6,he is been watching too many road runner cartoons,28,"['he', 'is', 'been', 'watching', 'too', 'many', 'road', 'runner', 'cartoons']",{'runner'},0
He's never seen a Road Runner cartoon.,1.2439024390243902,0.0507723414503934,123,101,14,8,he is never seen a road runner cartoon,28,"['he', 'is', 'never', 'seen', 'a', 'road', 'runner', 'cartoon']",{'runner'},-1
He marches to a really different drummer.,1.2377049180327868,0.0494561654427574,122,100,15,7,he marches to a really different drummer,28,"['he', 'marches', 'to', 'a', 'really', 'different', 'drummer']",{'drummer'},1
'He always marched to the tune of a different drummer.',1.2260869565217392,0.0510169197120502,115,96,12,7,he always marched to the tune of a different drummer,28,"['he', 'always', 'marched', 'to', 'the', 'tune', 'of', 'a', 'different', 'drummer']",{'drummer'},1
He walks to the beat of a different drummer,1.1886792452830188,0.0446876100083739,106,89,14,3,he walks to the beat of a different drummer,28,"['he', 'walks', 'to', 'the', 'beat', 'of', 'a', 'different', 'drummer']",{'drummer'},1
I told you he marches to a different drummer!,1.1683168316831682,0.0446533555793254,101,87,11,3,i told you he marches to a different drummer,28,"['i', 'told', 'you', 'he', 'marches', 'to', 'a', 'different', 'drummer']",{'drummer'},1
"Well, he always did march to the beat of a different drummer.",1.1666666666666667,0.0419929950739545,102,87,13,2,well he always did march to the beat of a different drummer,28,"['well', 'he', 'always', 'did', 'march', 'to', 'the', 'beat', 'of', 'a', 'different', 'drummer']",{'drummer'},1
Do you think he's listening to a different drummer?,1.1515151515151516,0.0362190487677088,99,84,15,0,do you think he is listening to a different drummer,28,"['do', 'you', 'think', 'he', 'is', 'listening', 'to', 'a', 'different', 'drummer']",{'drummer'},1
Jeremy always marched to the beat of a different drummer.,1.103448275862069,0.0401630024092935,87,80,5,2,jeremy always marched to the beat of a different drummer,28,"['jeremy', 'always', 'marched', 'to', 'the', 'beat', 'of', 'a', 'different', 'drummer']",{'drummer'},1
Helluva good cross trainers,1.103448275862069,0.0366845819952604,87,79,7,1,helluva good cross trainers,28,"['helluva', 'good', 'cross', 'trainers']",{'trainer'},0
Bertrand has always marched to his own drummer.,1.0930232558139534,0.0315053552295152,86,78,8,0,bertrand has always marched to his own drummer,28,"['bertrand', 'has', 'always', 'marched', 'to', 'his', 'own', 'drummer']",{'drummer'},1
He's related to the Road Runner,1.051282051282051,0.0251365627262945,78,74,4,0,he is related to the road runner,28,"['he', 'is', 'related', 'to', 'the', 'road', 'runner']",{'runner'},-1
"You've been out giving the other runners heart attacks, haven't you?",1.3768115942028984,0.0536441986395601,138,97,30,11,you have been out giving the other runners heart attacks have not you,29,"['you', 'have', 'been', 'out', 'giving', 'the', 'other', 'runners', 'heart', 'attacks', 'have', 'not', 'you']",{'runner'},0
I see they told you I'm a runner.,1.2268041237113405,0.0475001235284504,97,77,18,2,i see they told you i am a runner,29,"['i', 'see', 'they', 'told', 'you', 'i', 'am', 'a', 'runner']",{'runner'},0
You need more training yourself if you expect to catch any real runners.,1.1375,0.0495030685661843,80,72,5,3,you need more training yourself if you expect to catch any real runners,29,"['you', 'need', 'more', 'training', 'yourself', 'if', 'you', 'expect', 'to', 'catch', 'any', 'real', 'runners']",{'runner'},0
Cootie-catcher.,1.123456790123457,0.0407594420227633,81,72,8,1,cootie catcher,30,"['cootie', 'catcher']",{'catcher'},0
"When they said that they were desk jockeys, I honestly didn't know that we would be the horses.",1.2545454545454546,0.0829513744147386,55,46,4,5,when they said that they were desk jockeys i honestly did not know that we would be the horses,32,"['when', 'they', 'said', 'that', 'they', 'were', 'desk', 'jockeys', 'i', 'honestly', 'did', 'not', 'know', 'that', 'we', 'would', 'be', 'the', 'horses']",{'jockey'},0
Do you want to be the pitcher or the catcher?,1.0263157894736843,0.0266690373531332,38,37,1,0,do you want to be the pitcher or the catcher,32,"['do', 'you', 'want', 'to', 'be', 'the', 'pitcher', 'or', 'the', 'catcher']","{'pitcher', 'catcher'}",0
"Dave, this is not what I meant when I said you and Tim needed to be ""desk jockeys"".",1.0256410256410255,0.0259762166733065,39,38,1,0,dave this is not what i meant when i said you and tim needed to be desk jockeys,32,"['dave', 'this', 'is', 'not', 'what', 'i', 'meant', 'when', 'i', 'said', 'you', 'and', 'tim', 'needed', 'to', 'be', 'desk', 'jockeys']",{'jockey'},0
I want us all to focus on the big pitcher.,1.2575757575757576,0.0658832974741203,66,52,11,3,i want us all to focus on the big pitcher,33,"['i', 'want', 'us', 'all', 'to', 'focus', 'on', 'the', 'big', 'pitcher']",{'pitcher'},0
We never should have mentioned we were trainers.,1.234375,0.0658513669543913,64,52,9,3,we never should have mentioned we were trainers,34,"['we', 'never', 'should', 'have', 'mentioned', 'we', 'were', 'trainers']",{'trainer'},0
I’m thinking they’re either Sea World escapees or really weird synchronized swimmers.,1.2,0.0619823193306326,60,50,8,2,i am thinking they are either sea world escapees or really weird synchronized swimmers,34,"['i', 'am', 'thinking', 'they', 'are', 'either', 'sea', 'world', 'escapees', 'or', 'really', 'weird', 'synchronized', 'swimmers']",{'swimmer'},0
I believe their trainer was synchronized swimmer.,1.2,0.0572436560519337,60,49,10,1,i believe their trainer was synchronized swimmer,34,"['i', 'believe', 'their', 'trainer', 'was', 'synchronized', 'swimmer']",{'swimmer'},0
I knew we should have marched to the beat of a different drummer.,1.555984555984556,0.0476841216994328,259,159,56,44,i knew we should have marched to the beat of a different drummer,35,"['i', 'knew', 'we', 'should', 'have', 'marched', 'to', 'the', 'beat', 'of', 'a', 'different', 'drummer']",{'drummer'},1
We should try marching to the beat of a different drummer.,1.3475177304964538,0.050313923942947,141,101,31,9,we should try marching to the beat of a different drummer,35,"['we', 'should', 'try', 'marching', 'to', 'the', 'beat', 'of', 'a', 'different', 'drummer']",{'drummer'},1
