caption,mean,precision,votes,not_funny,somewhat_funny,funny,cleaned_caption_v2,contest_id,tokens,occupations,topic
It's supposed to be a decoy that attracts other swimmers.,1.3333333333333333,0.0405924318200401,219,161,43,15,it is supposed to be a decoy that attracts other swimmers,153,"['it', 'is', 'supposed', 'to', 'be', 'a', 'decoy', 'that', 'attracts', 'other', 'swimmers']",{'swimmer'},0
"Since  I hired him to be my lookout, I’ve  stopped scaring the swimmers away.",1.312169312169312,0.0432881101480206,189,143,33,13,since i hired him to be my lookout i have stopped scaring the swimmers away,153,"['since', 'i', 'hired', 'him', 'to', 'be', 'my', 'lookout', 'i', 'have', 'stopped', 'scaring', 'the', 'swimmers', 'away']","{'lookout', 'swimmer'}",0
"Until Shark Week starts filming again, I have to make ends meet by providing ride-sharing for swimmers.",1.3103448275862069,0.0451050123497597,174,132,30,12,until shark week starts filming again i have to make ends meet by providing ride sharing for swimmers,153,"['until', 'shark', 'week', 'starts', 'filming', 'again', 'i', 'have', 'to', 'make', 'ends', 'meet', 'by', 'providing', 'ride', 'sharing', 'for', 'swimmers']",{'swimmer'},0
This is my friend Larry. He’s not much of a swimmer.”,1.294478527607362,0.0443185976790394,163,124,30,9,this is my friend larry he is not much of a swimmer ”,153,"['this', 'is', 'my', 'friend', 'larry', 'he', 'is', 'not', 'much', 'of', 'a', 'swimmer', '”']",{'swimmer'},0
I'm his Uber diver.,1.290909090909091,0.0430010414440838,165,125,32,8,i am his uber diver,153,"['i', 'am', 'his', 'uber', 'diver']",{'diver'},0
"That disguise is not going to fool any of the swimmers, Sal.",1.2792207792207793,0.0455998260341851,154,120,25,9,that disguise is not going to fool any of the swimmers sal,153,"['that', 'disguise', 'is', 'not', 'going', 'to', 'fool', 'any', 'of', 'the', 'swimmers', 'sal']",{'swimmer'},0
Grubhub delivery - did you order one whole swimmer and a coke?,1.2781456953642385,0.0442339160450938,151,116,28,7,grubhub delivery did you order one whole swimmer and a coke,153,"['grubhub', 'delivery', 'did', 'you', 'order', 'one', 'whole', 'swimmer', 'and', 'a', 'coke']",{'swimmer'},0
The weather is getting warm and this is my first swimmer of the season.,1.2689655172413794,0.047196471649765,145,115,21,9,the weather is getting warm and this is my first swimmer of the season,153,"['the', 'weather', 'is', 'getting', 'warm', 'and', 'this', 'is', 'my', 'first', 'swimmer', 'of', 'the', 'season']",{'swimmer'},0
"I'm stuffed after that last swimmer, but please, feel free to help yourself.",1.255639097744361,0.0448461781228279,133,104,24,5,i am stuffed after that last swimmer but please feel free to help yourself,153,"['i', 'am', 'stuffed', 'after', 'that', 'last', 'swimmer', 'but', 'please', 'feel', 'free', 'to', 'help', 'yourself']",{'swimmer'},0
"My favorite, swimmer surprise!",1.2419354838709675,0.043410481882965,124,97,24,3,my favorite swimmer surprise,153,"['my', 'favorite', 'swimmer', 'surprise']",{'swimmer'},0
What?  He said he'd lure in some other swimmers if I didn't eat him.,1.2396694214876034,0.0454920956843731,121,96,21,4,what he said he would lure in some other swimmers if i did not eat him,153,"['what', 'he', 'said', 'he', 'would', 'lure', 'in', 'some', 'other', 'swimmers', 'if', 'i', 'did', 'not', 'eat', 'him']",{'swimmer'},0
He’s way more alarming to swimmers than my dorsal fin.,1.2149532710280373,0.0440980404168743,107,86,19,2,he is way more alarming to swimmers than my dorsal fin,153,"['he', 'is', 'way', 'more', 'alarming', 'to', 'swimmers', 'than', 'my', 'dorsal', 'fin']",{'swimmer'},0
"I  guess  the  swimmer  was   not  as  fast  as
I   thought!""",1.2149532710280373,0.0460540216687255,107,87,17,3,i guess the swimmer was not as fast as i thought,153,"['i', 'guess', 'the', 'swimmer', 'was', 'not', 'as', 'fast', 'as', 'i', 'thought']",{'swimmer'},0
Let's just say I understand the average American swimmer.,1.1914893617021276,0.0484879957753742,94,79,12,3,let us just say i understand the average american swimmer,153,"['let', 'us', 'just', 'say', 'i', 'understand', 'the', 'average', 'american', 'swimmer']",{'swimmer'},0
"Its the latest in camouflage technology, its supposed to allow you to get right up close to those unsuspecting swimmers !",1.1744186046511629,0.0473421069773522,86,73,11,2,its the latest in camouflage technology its supposed to allow you to get right up close to those unsuspecting swimmers,153,"['its', 'the', 'latest', 'in', 'camouflage', 'technology', 'its', 'supposed', 'to', 'allow', 'you', 'to', 'get', 'right', 'up', 'close', 'to', 'those', 'unsuspecting', 'swimmers']",{'swimmer'},0
Lyft was looking for divers and I needed the chub change,1.1686746987951808,0.0413526689470355,83,69,14,0,lyft was looking for divers and i needed the chub change,153,"['lyft', 'was', 'looking', 'for', 'divers', 'and', 'i', 'needed', 'the', 'chub', 'change']",{'diver'},0
"It's something like Uber for swimmers. Pretty good pay, but they fire you if you eat a passenger.",1.1686746987951808,0.0479349554040036,83,71,10,2,it is something like uber for swimmers pretty good pay but they fire you if you eat a passenger,153,"['it', 'is', 'something', 'like', 'uber', 'for', 'swimmers', 'pretty', 'good', 'pay', 'but', 'they', 'fire', 'you', 'if', 'you', 'eat', 'a', 'passenger']",{'swimmer'},0
I'm an Uber Diver now.,1.1538461538461535,0.0485450073770014,78,68,8,2,i am an uber diver now,153,"['i', 'am', 'an', 'uber', 'diver', 'now']",{'diver'},0
I'm picking up some extra cash being an Uber-swimmer.,1.1538461538461535,0.0449846352461904,78,67,10,1,i am picking up some extra cash being an uber swimmer,153,"['i', 'am', 'picking', 'up', 'some', 'extra', 'cash', 'being', 'an', 'uber', 'swimmer']",{'swimmer'},0
"I got it to attract swimmers.  If you get one, have a blowfish inflate it!",1.1369863013698631,0.0449719534328588,73,64,8,1,i got it to attract swimmers if you get one have a blowfish inflate it,153,"['i', 'got', 'it', 'to', 'attract', 'swimmers', 'if', 'you', 'get', 'one', 'have', 'a', 'blowfish', 'inflate', 'it']",{'swimmer'},0
Wanna come watch the swimmers when the two of us hit the beach?,1.0740740740740742,0.0359735504576763,54,50,4,0,want to come watch the swimmers when the two of us hit the beach,153,"['want', 'to', 'come', 'watch', 'the', 'swimmers', 'when', 'the', 'two', 'of', 'us', 'hit', 'the', 'beach']",{'swimmer'},0
"Well it's more comfortable than the catcher's mitt, I'll give you that...",1.263157894736842,0.0501074462904371,95,72,21,2,well it is more comfortable than the catcher s mitt i will give you that,154,"['well', 'it', 'is', 'more', 'comfortable', 'than', 'the', 'catcher', 's', 'mitt', 'i', 'will', 'give', 'you', 'that']",{'catcher'},0
"I love bread, so let's get rod of the catcher in the rye.",1.173913043478261,0.0459647078148629,69,57,12,0,i love bread so let us get rod of the catcher in the rye,155,"['i', 'love', 'bread', 'so', 'let', 'us', 'get', 'rod', 'of', 'the', 'catcher', 'in', 'the', 'rye']",{'catcher'},0
"I promise, all mice will be amazed by this new maize maze! Then at the grand opening we could serve popcorn, listen to 'Popcorn' , maybe do a 'Maze Runner'-marathon... Wonder if Maisie Williams would like to come?",1.0833333333333333,0.040314953903908,48,44,4,0,i promise all mice will be amazed by this new maize maze then at the grand opening we could serve popcorn listen to popcorn maybe do a maze runner marathon wonder if maisie williams would like to come,155,"['i', 'promise', 'all', 'mice', 'will', 'be', 'amazed', 'by', 'this', 'new', 'maize', 'maze', 'then', 'at', 'the', 'grand', 'opening', 'we', 'could', 'serve', 'popcorn', 'listen', 'to', 'popcorn', 'maybe', 'do', 'a', 'maze', 'runner', 'marathon', 'wonder', 'if', 'maisie', 'williams', 'would', 'like', 'to', 'come']",{'runner'},0
Lets make a drummer,1.2747252747252746,0.0626362915745027,91,73,11,7,let us make a drummer,157,"['let', 'us', 'make', 'a', 'drummer']",{'drummer'},1
I can't wait 'til we make a drummer!,1.2173913043478262,0.0579177078014866,69,56,11,2,i can not wait til we make a drummer,157,"['i', 'can', 'not', 'wait', 'til', 'we', 'make', 'a', 'drummer']",{'drummer'},1
"True, he's a political newcomer, but if the front runner stumbles...,",1.1346153846153846,0.0477932809372796,52,45,7,0,true he is a political newcomer but if the front runner stumbles,157,"['true', 'he', 'is', 'a', 'political', 'newcomer', 'but', 'if', 'the', 'front', 'runner', 'stumbles']",{'runner'},0
Look -- he's not gonna be a drummer!,1.1346153846153846,0.0551211893532884,52,46,5,1,look he is not going to be a drummer,157,"['look', 'he', 'is', 'not', 'going', 'to', 'be', 'a', 'drummer']",{'drummer'},1
"Honey, it's going to be alright. Apparently his cousin wants to be a drummer when he grows up.",1.1063829787234043,0.0454603603156544,47,42,5,0,honey it is going to be alright apparently his cousin wants to be a drummer when he grows up,157,"['honey', 'it', 'is', 'going', 'to', 'be', 'alright', 'apparently', 'his', 'cousin', 'wants', 'to', 'be', 'a', 'drummer', 'when', 'he', 'grows', 'up']",{'drummer'},1
The pitcher and catcher fell off on the way over here.,1.3625,0.038145307770176,240,167,59,14,the pitcher and catcher fell off on the way over here,159,"['the', 'pitcher', 'and', 'catcher', 'fell', 'off', 'on', 'the', 'way', 'over', 'here']","{'pitcher', 'catcher'}",0
Best flea-catchers I've tried; I'll share if you like.,1.2410714285714286,0.0443847105210594,112,87,23,2,best flea catchers i have tried i will share if you like,159,"['best', 'flea', 'catchers', 'i', 'have', 'tried', 'i', 'will', 'share', 'if', 'you', 'like']",{'catcher'},0
Still have that cootie catcher?”,1.2410714285714286,0.0461614307502854,112,88,21,3,still have that cootie catcher ”,159,"['still', 'have', 'that', 'cootie', 'catcher', '”']",{'catcher'},0
Call the rat catcher and I'll kill you !,1.2159090909090908,0.0522454610637793,88,72,13,3,call the rat catcher and i will kill you,160,"['call', 'the', 'rat', 'catcher', 'and', 'i', 'will', 'kill', 'you']",{'catcher'},0
The first hair skier.,1.1168831168831168,0.036853453360789,77,68,9,0,the first hair skier,161,"['the', 'first', 'hair', 'skier']",{'skier'},0
"A scuba diver and an astronaut walk into a bar. After a couple shots, one was in over his head and the other felt out of this world",1.5284848484848486,0.0243050089473401,825,487,240,98,a scuba diver and an astronaut walk into a bar after a couple shots one was in over his head and the other felt out of this world,163,"['a', 'scuba', 'diver', 'and', 'an', 'astronaut', 'walk', 'into', 'a', 'bar', 'after', 'a', 'couple', 'shots', 'one', 'was', 'in', 'over', 'his', 'head', 'and', 'the', 'other', 'felt', 'out', 'of', 'this', 'world']","{'diver', 'astronaut'}",0
Is that your designated diver?,1.4853228962818004,0.0294247263150266,511,312,150,49,is that your designated diver,163,"['is', 'that', 'your', 'designated', 'diver']",{'diver'},0
"So. An astronaut, a deep sea diver, and a red head meet in a bar. Stop me if you've already heard this one.",1.4699074074074074,0.0310587013463516,432,265,131,36,so an astronaut a deep sea diver and a red head meet in a bar stop me if you have already heard this one,163,"['so', 'an', 'astronaut', 'a', 'deep', 'sea', 'diver', 'and', 'a', 'red', 'head', 'meet', 'in', 'a', 'bar', 'stop', 'me', 'if', 'you', 'have', 'already', 'heard', 'this', 'one']","{'diver', 'astronaut'}",0
"Hey,guys...(hic)...so a diver and an astronaut walk into a bar...",1.4556650246305418,0.0325955544878952,406,258,111,37,hey guys hic so a diver and an astronaut walk into a bar,163,"['hey', 'guys', 'hic', 'so', 'a', 'diver', 'and', 'an', 'astronaut', 'walk', 'into', 'a', 'bar']","{'diver', 'astronaut'}",0
"Hey, did you hear the one about the scuba diver, the astronaut and the nymphomaniac?",1.4406779661016949,0.035922502527889,354,235,82,37,hey did you hear the one about the scuba diver the astronaut and the nymphomaniac,163,"['hey', 'did', 'you', 'hear', 'the', 'one', 'about', 'the', 'scuba', 'diver', 'the', 'astronaut', 'and', 'the', 'nymphomaniac']","{'diver', 'astronaut'}",0
"Okay, a diver and an astronaut walk into a cocktail party. Stop me if you've lived this one...",1.4191419141914192,0.0361782357224865,303,199,81,23,okay a diver and an astronaut walk into a cocktail party stop me if you have lived this one,163,"['okay', 'a', 'diver', 'and', 'an', 'astronaut', 'walk', 'into', 'a', 'cocktail', 'party', 'stop', 'me', 'if', 'you', 'have', 'lived', 'this', 'one']","{'diver', 'astronaut'}",0
"Hon, I'd like you to meet our designated diver.",1.4152249134948096,0.0392421801406259,289,198,62,29,hon i would like you to meet our designated diver,163,"['hon', 'i', 'would', 'like', 'you', 'to', 'meet', 'our', 'designated', 'diver']",{'diver'},0
"Let me guess, you're the designated diver.",1.412811387900356,0.0367243332452416,281,184,78,19,let me guess you are the designated diver,163,"['let', 'me', 'guess', 'you', 'are', 'the', 'designated', 'diver']",{'diver'},0
"Hey, have you guys heard the one about the diver, the astronaut, and the drunken hostess?",1.4121863799283154,0.0392679733144017,279,190,63,26,hey have you guys heard the one about the diver the astronaut and the drunken hostess,163,"['hey', 'have', 'you', 'guys', 'heard', 'the', 'one', 'about', 'the', 'diver', 'the', 'astronaut', 'and', 'the', 'drunken', 'hostess']","{'diver', 'astronaut'}",0
"I bet you assumed the diver and the astronaut were men, didn't you? Sexist.",1.4039215686274509,0.0418419647528613,255,178,51,26,i bet you assumed the diver and the astronaut were men did not you sexist,163,"['i', 'bet', 'you', 'assumed', 'the', 'diver', 'and', 'the', 'astronaut', 'were', 'men', 'did', 'not', 'you', 'sexist']","{'diver', 'astronaut'}",0
We asked for designated drivers not designated divers.,1.4015444015444016,0.0387310664847998,259,174,66,19,we asked for designated drivers not designated divers,163,"['we', 'asked', 'for', 'designated', 'drivers', 'not', 'designated', 'divers']","{'driver', 'diver'}",0
You must be the Designated Diver !!,1.387931034482759,0.0421219801579894,232,162,50,20,you must be the designated diver,163,"['you', 'must', 'be', 'the', 'designated', 'diver']",{'diver'},0
Have you heard the one about an astronaut and a diver walk into a cocktail party?,1.3852813852813852,0.0394556305922379,231,156,61,14,have you heard the one about an astronaut and a diver walk into a cocktail party,163,"['have', 'you', 'heard', 'the', 'one', 'about', 'an', 'astronaut', 'and', 'a', 'diver', 'walk', 'into', 'a', 'cocktail', 'party']","{'diver', 'astronaut'}",0
So an astronaut and a scuba diver walk into a party.,1.3689320388349515,0.0429663656044427,206,145,46,15,so an astronaut and a scuba diver walk into a party,163,"['so', 'an', 'astronaut', 'and', 'a', 'scuba', 'diver', 'walk', 'into', 'a', 'party']","{'diver', 'astronaut'}",0
"I dunno, what did the space man say to the deep sea diver?",1.361256544502618,0.0445649798901257,191,136,41,14,i do not know what did the space man say to the deep sea diver,163,"['i', 'do', 'not', 'know', 'what', 'did', 'the', 'space', 'man', 'say', 'to', 'the', 'deep', 'sea', 'diver']",{'diver'},0
"So a diver, an astronaut and a handmaiden come to what they thought was a costume party . . . !",1.346820809248555,0.0446004922238531,173,123,40,10,so a diver an astronaut and a handmaiden come to what they thought was a costume party,163,"['so', 'a', 'diver', 'an', 'astronaut', 'and', 'a', 'handmaiden', 'come', 'to', 'what', 'they', 'thought', 'was', 'a', 'costume', 'party']","{'diver', 'astronaut'}",0
"So a diver, an astronaut and a drunk walk into a bar..._Stop me if you've heard this one.",1.3452380952380951,0.0446672065522524,168,119,40,9,so a diver an astronaut and a drunk walk into a bar stop me if you have heard this one,163,"['so', 'a', 'diver', 'an', 'astronaut', 'and', 'a', 'drunk', 'walk', 'into', 'a', 'bar', 'stop', 'me', 'if', 'you', 'have', 'heard', 'this', 'one']","{'diver', 'astronaut'}",0
Which one of you is the designated diver?,1.3393939393939394,0.0450809977265522,165,118,38,9,which one of you is the designated diver,163,"['which', 'one', 'of', 'you', 'is', 'the', 'designated', 'diver']",{'diver'},0
"Yeah, I know I have a Buzz. Good thing you're my designated diver.",1.3245033112582782,0.0456008877127606,151,109,35,7,yeah i know i have a buzz good thing you are my designated diver,163,"['yeah', 'i', 'know', 'i', 'have', 'a', 'buzz', 'good', 'thing', 'you', 'are', 'my', 'designated', 'diver']",{'diver'},0
"Hey honey, aren't you glad we came to this party with a designated diver?",1.3245033112582782,0.051080742797018,151,115,23,13,hey honey are not you glad we came to this party with a designated diver,163,"['hey', 'honey', 'are', 'not', 'you', 'glad', 'we', 'came', 'to', 'this', 'party', 'with', 'a', 'designated', 'diver']",{'diver'},0
So a Diver and an Astronaut wall into a bar...,1.3120567375886525,0.0494496067138964,141,106,26,9,so a diver and an astronaut wall into a bar,163,"['so', 'a', 'diver', 'and', 'an', 'astronaut', 'wall', 'into', 'a', 'bar']","{'diver', 'astronaut'}",0
I was told one of is the designated diver.,1.3120567375886525,0.0504636574848945,141,107,24,10,i was told one of is the designated diver,163,"['i', 'was', 'told', 'one', 'of', 'is', 'the', 'designated', 'diver']",{'diver'},0
"It was my childhood dream to be an astronaut or a scuba diver. Then, I grew up and chose alcohol instead.",1.3093525179856116,0.0466240338014953,139,102,31,6,it was my childhood dream to be an astronaut or a scuba diver then i grew up and chose alcohol instead,163,"['it', 'was', 'my', 'childhood', 'dream', 'to', 'be', 'an', 'astronaut', 'or', 'a', 'scuba', 'diver', 'then', 'i', 'grew', 'up', 'and', 'chose', 'alcohol', 'instead']","{'diver', 'astronaut'}",0
"Imaginery deep sea diver, meet my friend imaginery astronaut .",1.3093525179856116,0.0466240338014953,139,102,31,6,imaginery deep sea diver meet my friend imaginery astronaut,163,"['imaginery', 'deep', 'sea', 'diver', 'meet', 'my', 'friend', 'imaginery', 'astronaut']","{'diver', 'astronaut'}",0
Did you hear the one about the deep sea diver and the astronaut?,1.302325581395349,0.0474707314492863,129,95,29,5,did you hear the one about the deep sea diver and the astronaut,163,"['did', 'you', 'hear', 'the', 'one', 'about', 'the', 'deep', 'sea', 'diver', 'and', 'the', 'astronaut']","{'diver', 'astronaut'}",0
Have you heard the one about the astronaut and the deep sea diver?,1.280701754385965,0.0521376188957463,114,88,20,6,have you heard the one about the astronaut and the deep sea diver,163,"['have', 'you', 'heard', 'the', 'one', 'about', 'the', 'astronaut', 'and', 'the', 'deep', 'sea', 'diver']","{'diver', 'astronaut'}",0
"If we get one more joke about an astronaut and a diver walking into a bar, I am launching myself 20,000 leagues under the sea.",1.2727272727272727,0.0515143338338023,110,85,20,5,if we get one more joke about an astronaut and a diver walking into a bar i am launching myself 20 000 leagues under the sea,163,"['if', 'we', 'get', 'one', 'more', 'joke', 'about', 'an', 'astronaut', 'and', 'a', 'diver', 'walking', 'into', 'a', 'bar', 'i', 'am', 'launching', 'myself', '20', '000', 'leagues', 'under', 'the', 'sea']","{'diver', 'astronaut'}",0
"""Well, well, if it's not my deep sea diver and the guy that took me out of this world!""",1.2695652173913043,0.0498995774604349,115,89,21,5,well well if it is not my deep sea diver and the guy that took me out of this world,163,"['well', 'well', 'if', 'it', 'is', 'not', 'my', 'deep', 'sea', 'diver', 'and', 'the', 'guy', 'that', 'took', 'me', 'out', 'of', 'this', 'world']",{'diver'},0
"Hey, I get it!  I dated scuba diver in college.",1.2549019607843137,0.0496273719371679,102,79,20,3,hey i get it i dated scuba diver in college,163,"['hey', 'i', 'get', 'it', 'i', 'dated', 'scuba', 'diver', 'in', 'college']",{'diver'},0
Is it me or is that a scuba diver?,1.2371134020618555,0.0523773232806741,97,78,15,4,is it me or is that a scuba diver,163,"['is', 'it', 'me', 'or', 'is', 'that', 'a', 'scuba', 'diver']",{'diver'},0
Did you hear about an astronaut and deep sea diver sitting in a bar?,1.2222222222222223,0.05187562620058,90,73,14,3,did you hear about an astronaut and deep sea diver sitting in a bar,163,"['did', 'you', 'hear', 'about', 'an', 'astronaut', 'and', 'deep', 'sea', 'diver', 'sitting', 'in', 'a', 'bar']","{'diver', 'astronaut'}",0
Did you hear the one about the spaceman and the deep-sea diver? Me neither; I’m just wasted.,1.2183908045977012,0.047456806164156,87,69,17,1,did you hear the one about the spaceman and the deep sea diver me neither i am just wasted,163,"['did', 'you', 'hear', 'the', 'one', 'about', 'the', 'spaceman', 'and', 'the', 'deep', 'sea', 'diver', 'me', 'neither', 'i', 'am', 'just', 'wasted']",{'diver'},0
Divers and astronauts - my favorite kind of women!,1.216867469879518,0.0569789769271226,83,69,10,4,divers and astronauts my favorite kind of women,163,"['divers', 'and', 'astronauts', 'my', 'favorite', 'kind', 'of', 'women']","{'diver', 'astronaut'}",0
"When you think about it, astronauts are just space divers.",1.216867469879518,0.0515643975153484,83,67,14,2,when you think about it astronauts are just space divers,163,"['when', 'you', 'think', 'about', 'it', 'astronauts', 'are', 'just', 'space', 'divers']","{'diver', 'astronaut'}",0
"So, a deep sea diver and an astronaut walk into a bar ...",1.2159090909090908,0.0496825440362425,88,71,15,2,so a deep sea diver and an astronaut walk into a bar,163,"['so', 'a', 'deep', 'sea', 'diver', 'and', 'an', 'astronaut', 'walk', 'into', 'a', 'bar']","{'diver', 'astronaut'}",0
"Diver Dan, Major Matt Mason
Major, Diver  Dan",1.2142857142857142,0.0537504181398526,84,69,12,3,diver dan major matt mason major diver dan,163,"['diver', 'dan', 'major', 'matt', 'mason', 'major', 'diver', 'dan']","{'diver', 'mason'}",0
"Believe me, after four years of marriage “Diver Dan” is NOT what I would call him. He couldn’t take that “one small step”, know what I mean?",1.2125,0.0524517560131284,80,65,13,2,believe me after four years of marriage “ diver dan ” is not what i would call him he could not take that “ one small step ” know what i mean,163,"['believe', 'me', 'after', 'four', 'years', 'of', 'marriage', '“', 'diver', 'dan', '”', 'is', 'not', 'what', 'i', 'would', 'call', 'him', 'he', 'could', 'not', 'take', 'that', '“', 'one', 'small', 'step', '”', 'know', 'what', 'i', 'mean']",{'diver'},0
I just adore space divers.,1.2125,0.0493429935518532,80,64,15,1,i just adore space divers,163,"['i', 'just', 'adore', 'space', 'divers']",{'diver'},0
Did I mention that my first husband played catcher for the Yankees.,1.205128205128205,0.052759276388894,78,64,12,2,did i mention that my first husband played catcher for the yankees,163,"['did', 'i', 'mention', 'that', 'my', 'first', 'husband', 'played', 'catcher', 'for', 'the', 'yankees']",{'catcher'},0
There you are.  You'll be wonderful hits at this cocktail party describing your divers' pursuits.,1.2,0.0569494797451499,75,63,9,3,there you are you will be wonderful hits at this cocktail party describing your divers pursuits,163,"['there', 'you', 'are', 'you', 'will', 'be', 'wonderful', 'hits', 'at', 'this', 'cocktail', 'party', 'describing', 'your', 'divers', 'pursuits']",{'diver'},0
Totally true story I met them at Mercury Lounge in '94 we split halfway through Helmet's set and yeah I fucked the drummer from Primus.,1.1973684210526316,0.0562567324379788,76,64,9,3,totally true story i met them at mercury lounge in 94 we split halfway through helmet s set and yeah i fucked the drummer from primus,163,"['totally', 'true', 'story', 'i', 'met', 'them', 'at', 'mercury', 'lounge', 'in', '94', 'we', 'split', 'halfway', 'through', 'helmet', 's', 'set', 'and', 'yeah', 'i', 'fucked', 'the', 'drummer', 'from', 'primus']",{'drummer'},1
"When Mary jokingly asked if the diver and the astronaut smoked sea weed and moon rocks respectively, they responded that they did indeed smoke. Though they didn’t smoke these silly things. They smoked crack.",1.1971830985915493,0.0588956664031411,71,60,8,3,when mary jokingly asked if the diver and the astronaut smoked sea weed and moon rocks respectively they responded that they did indeed smoke though they did not smoke these silly things they smoked crack,163,"['when', 'mary', 'jokingly', 'asked', 'if', 'the', 'diver', 'and', 'the', 'astronaut', 'smoked', 'sea', 'weed', 'and', 'moon', 'rocks', 'respectively', 'they', 'responded', 'that', 'they', 'did', 'indeed', 'smoke', 'though', 'they', 'did', 'not', 'smoke', 'these', 'silly', 'things', 'they', 'smoked', 'crack']","{'diver', 'astronaut'}",0
Did you hear the one about a deep sea diver and a spaceman walk into a bar?,1.15625,0.0457453159194624,64,54,10,0,did you hear the one about a deep sea diver and a spaceman walk into a bar,163,"['did', 'you', 'hear', 'the', 'one', 'about', 'a', 'deep', 'sea', 'diver', 'and', 'a', 'spaceman', 'walk', 'into', 'a', 'bar']",{'diver'},0
Probably because it wasn't on TV and that 'one small step for a deep-sea diver' remark just didn't cut it.,1.1538461538461535,0.0451001515367637,65,55,10,0,probably because it was not on tv and that one small step for a deep sea diver remark just did not cut it,163,"['probably', 'because', 'it', 'was', 'not', 'on', 'tv', 'and', 'that', 'one', 'small', 'step', 'for', 'a', 'deep', 'sea', 'diver', 'remark', 'just', 'did', 'not', 'cut', 'it']",{'diver'},0
"Diver Dan, will yooo help meee put my MT-hic - excuse me - MTV- Myooo-zic Vid-ee-ohhh Awarrrd back up on my mantlepeesh?",1.125,0.0445941292507922,56,49,7,0,diver dan will yooo help meee put my mt hic excuse me mtv myooo zic vid ee ohhh awarrrd back up on my mantlepeesh,163,"['diver', 'dan', 'will', 'yooo', 'help', 'meee', 'put', 'my', 'mt', 'hic', 'excuse', 'me', 'mtv', 'myooo', 'zic', 'vid', 'ee', 'ohhh', 'awarrrd', 'back', 'up', 'on', 'my', 'mantlepeesh']",{'diver'},0
