caption,mean,precision,votes,not_funny,somewhat_funny,funny,cleaned_caption_v2,contest_id,tokens,occupations,topic
These quotes from piano movers are rediculous,1.295774647887324,0.0517293892941739,142,112,18,12,these quotes from piano movers are rediculous,280,"['these', 'quotes', 'from', 'piano', 'movers', 'are', 'rediculous']",{'mover'},2
It's a bill from the piano movers.,1.2933333333333332,0.0468675764690954,150,115,26,9,it is a bill from the piano movers,280,"['it', 'is', 'a', 'bill', 'from', 'the', 'piano', 'movers']",{'mover'},-1
Another estimate from the movers:  the piano's definitely staying here.,1.275,0.0541841708411958,120,96,15,9,another estimate from the movers the piano s definitely staying here,280,"['another', 'estimate', 'from', 'the', 'movers', 'the', 'piano', 's', 'definitely', 'staying', 'here']",{'mover'},2
Now we know what they did with the drunken sailor.,1.272,0.0473504436740463,125,96,24,5,now we know what they did with the drunken sailor,280,"['now', 'we', 'know', 'what', 'they', 'did', 'with', 'the', 'drunken', 'sailor']",{'sailor'},-1
"It’s good, but I’d change pilots life to pirates life, I prefer the rum.",1.2454545454545454,0.0503306227100286,110,88,17,5,it is good but i would change pilots life to pirates life i prefer the rum,280,"['it', 'is', 'good', 'but', 'i', 'would', 'change', 'pilots', 'life', 'to', 'pirates', 'life', 'i', 'prefer', 'the', 'rum']",{'pilot'},0
It's those sailors that passed us yesterday. They said that third note should have been an E flat.,1.2061855670103092,0.0506362956298672,97,81,12,4,it is those sailors that passed us yesterday they said that third note should have been an e flat,280,"['it', 'is', 'those', 'sailors', 'that', 'passed', 'us', 'yesterday', 'they', 'said', 'that', 'third', 'note', 'should', 'have', 'been', 'an', 'e', 'flat']",{'sailor'},0
It's a bill from Steinway and Sons. Guess the movers gave them our new address.,1.1962616822429906,0.0449126826523529,107,89,15,3,it is a bill from steinway and sons guess the movers gave them our new address,280,"['it', 'is', 'a', 'bill', 'from', 'steinway', 'and', 'sons', 'guess', 'the', 'movers', 'gave', 'them', 'our', 'new', 'address']",{'mover'},-1
"Oh no! It's yet another arrangement of ""Drunken Sailor.""",1.175257731958763,0.0414780333490491,97,81,15,1,oh no it is yet another arrangement of drunken sailor,280,"['oh', 'no', 'it', 'is', 'yet', 'another', 'arrangement', 'of', 'drunken', 'sailor']",{'sailor'},0
"Sailors will come for this, ""Open Bar tonight at the Castaway Cabaret"".",1.1578947368421053,0.0456771607876676,95,83,9,3,sailors will come for this open bar tonight at the castaway cabaret,280,"['sailors', 'will', 'come', 'for', 'this', 'open', 'bar', 'tonight', 'at', 'the', 'castaway', 'cabaret']",{'sailor'},0
I need to know the name and number of the fisherman who caught this fish,1.279279279279279,0.0530343346378408,111,86,19,6,i need to know the name and number of the fisherman who caught this fish,281,"['i', 'need', 'to', 'know', 'the', 'name', 'and', 'number', 'of', 'the', 'fisherman', 'who', 'caught', 'this', 'fish']",{'fisherman'},0
"I’d return the fisherman too, but he’s already been used.",1.2597402597402598,0.0651057224302429,77,62,10,5,i would return the fisherman too but he is already been used,281,"['i', 'would', 'return', 'the', 'fisherman', 'too', 'but', 'he', 'is', 'already', 'been', 'used']",{'fisherman'},0
Guaranteed harvested post-spawning by Indigenous fishermen with tribal rights.,1.2345679012345678,0.0615429312622939,81,67,9,5,guaranteed harvested post spawning by indigenous fishermen with tribal rights,281,"['guaranteed', 'harvested', 'post', 'spawning', 'by', 'indigenous', 'fishermen', 'with', 'tribal', 'rights']",{'fisherman'},0
Can you confirm this was wild caught by a fisherman wearing a mask and gloves?,1.178082191780822,0.0528577027524667,73,62,9,2,can you confirm this was wild caught by a fisherman wearing a mask and gloves,281,"['can', 'you', 'confirm', 'this', 'was', 'wild', 'caught', 'by', 'a', 'fisherman', 'wearing', 'a', 'mask', 'and', 'gloves']",{'fisherman'},0
"Do you offer a ""fishermen club"" discount?",1.1428571428571428,0.0441920160635532,77,67,9,1,do you offer a fishermen club discount,281,"['do', 'you', 'offer', 'a', 'fishermen', 'club', 'discount']",{'fisherman'},-1
The Uber Share driver isn't wearing a mask.,1.1866666666666668,0.0452951614596046,75,61,14,0,the uber share driver is not wearing a mask,282,"['the', 'uber', 'share', 'driver', 'is', 'not', 'wearing', 'a', 'mask']",{'driver'},0
"Apparently, they want to meet with the pilots' union steward.",1.1428571428571428,0.0441920160635532,77,67,9,1,apparently they want to meet with the pilots union steward,282,"['apparently', 'they', 'want', 'to', 'meet', 'with', 'the', 'pilots', 'union', 'steward']","{'steward', 'pilot'}",0
Why do pilots always seem to have big heads?,1.1168831168831168,0.0412303350007502,77,69,7,1,why do pilots always seem to have big heads,282,"['why', 'do', 'pilots', 'always', 'seem', 'to', 'have', 'big', 'heads']",{'pilot'},0
The movers went on strike.,1.2818791946308723,0.0437252035534335,149,113,30,6,the movers went on strike,284,"['the', 'movers', 'went', 'on', 'strike']",{'mover'},2
Darn. It looks like the movers lost one of our balls.,1.2121212121212122,0.0591909379882662,66,54,10,2,darn it looks like the movers lost one of our balls,284,"['darn', 'it', 'looks', 'like', 'the', 'movers', 'lost', 'one', 'of', 'our', 'balls']",{'mover'},2
I was wondering why I haven't seen my favorite delivery driver recently.,1.0945945945945943,0.0392870511441644,74,68,5,1,i was wondering why i have not seen my favorite delivery driver recently,284,"['i', 'was', 'wondering', 'why', 'i', 'have', 'not', 'seen', 'my', 'favorite', 'delivery', 'driver', 'recently']",{'driver'},0
Did you say something to the Uber driver?,1.0806451612903225,0.0417642846411701,62,58,3,1,did you say something to the uber driver,284,"['did', 'you', 'say', 'something', 'to', 'the', 'uber', 'driver']",{'driver'},0
"And just like that, Charlie's career as a Door Dash driver ended in a spectacularly ironic manner.",1.5671342685370742,0.0326248645003124,499,287,141,71,and just like that charlie s career as a door dash driver ended in a spectacularly ironic manner,286,"['and', 'just', 'like', 'that', 'charlie', 's', 'career', 'as', 'a', 'door', 'dash', 'driver', 'ended', 'in', 'a', 'spectacularly', 'ironic', 'manner']",{'driver'},-1
So you're an Uber Eats driver. How ironic.,1.5423728813559323,0.0341425759370811,472,287,114,71,so you are an uber eats driver how ironic,286,"['so', 'you', 'are', 'an', 'uber', 'eats', 'driver', 'how', 'ironic']",{'driver'},0
I've been waiting all day for a Tesla driver. But you'll do.,1.4586466165413534,0.0402230116009396,266,168,74,24,i have been waiting all day for a tesla driver but you will do,286,"['i', 'have', 'been', 'waiting', 'all', 'day', 'for', 'a', 'tesla', 'driver', 'but', 'you', 'will', 'do']",{'driver'},-1
"It will be worth the wait, the tow truck driver is twice my size!",1.444976076555024,0.0473869130357813,209,139,47,23,it will be worth the wait the tow truck driver is twice my size,286,"['it', 'will', 'be', 'worth', 'the', 'wait', 'the', 'tow', 'truck', 'driver', 'is', 'twice', 'my', 'size']",{'driver'},0
"If you let me call AAA,the drivers are usually a lot fatter and tastier.",1.4186046511627908,0.0501122312820701,172,116,40,16,if you let me call aaa the drivers are usually a lot fatter and tastier,286,"['if', 'you', 'let', 'me', 'call', 'aaa', 'the', 'drivers', 'are', 'usually', 'a', 'lot', 'fatter', 'and', 'tastier']","{'driver', 'fatter'}",0
"Thanks for offering, but I'm waiting to eat a tow truck driver.",1.3724137931034484,0.0526544686025119,145,103,30,12,thanks for offering but i am waiting to eat a tow truck driver,286,"['thanks', 'for', 'offering', 'but', 'i', 'am', 'waiting', 'to', 'eat', 'a', 'tow', 'truck', 'driver']",{'driver'},-1
"Now that's ironical, an Uber Eats driver.",1.3435114503816794,0.0539360796587066,131,96,25,10,now that is ironical an uber eats driver,286,"['now', 'that', 'is', 'ironical', 'an', 'uber', 'eats', 'driver']",{'driver'},0
"The seats are too soft, the engine to hard but the driver is juuuust right!",1.303030303030303,0.0564433108675554,99,74,20,5,the seats are too soft the engine to hard but the driver is juuuust right,286,"['the', 'seats', 'are', 'too', 'soft', 'the', 'engine', 'to', 'hard', 'but', 'the', 'driver', 'is', 'juuuust', 'right']",{'driver'},0
Once they get a taste for stranded driver they can’t help themselves.,1.2954545454545454,0.0649714407741774,88,69,12,7,once they get a taste for stranded driver they can not help themselves,286,"['once', 'they', 'get', 'a', 'taste', 'for', 'stranded', 'driver', 'they', 'can', 'not', 'help', 'themselves']",{'driver'},-1
My last Uber driver pulled a similar stunt,1.2765957446808511,0.0574056980264155,94,73,16,5,my last uber driver pulled a similar stunt,286,"['my', 'last', 'uber', 'driver', 'pulled', 'a', 'similar', 'stunt']",{'driver'},0
Are you the Uber driver or the meal?,1.2734375,0.0479845311027172,128,99,23,6,are you the uber driver or the meal,286,"['are', 'you', 'the', 'uber', 'driver', 'or', 'the', 'meal']",{'driver'},0
I too wish the tow truck driver  was here.,1.2696629213483146,0.0570916797241353,89,69,16,4,i too wish the tow truck driver was here,286,"['i', 'too', 'wish', 'the', 'tow', 'truck', 'driver', 'was', 'here']",{'driver'},0
"Want me to call my brother-in-law,Marvin? He’s a U-BEAR driver",1.2653061224489797,0.0571999354256631,98,78,14,6,want me to call my brother in law marvin he is a you bear driver,286,"['want', 'me', 'to', 'call', 'my', 'brother', 'in', 'law', 'marvin', 'he', 'is', 'a', 'you', 'bear', 'driver']",{'driver'},0
Setting a trap for the evil tow truck driver.,1.2524271844660195,0.0511032791167292,103,81,18,4,setting a trap for the evil tow truck driver,286,"['setting', 'a', 'trap', 'for', 'the', 'evil', 'tow', 'truck', 'driver']",{'driver'},0
The tow truck driver will taste better than I do - he eats a lot of fish.,1.2522522522522523,0.0519378266071364,111,89,16,6,the tow truck driver will taste better than i do he eats a lot of fish,286,"['the', 'tow', 'truck', 'driver', 'will', 'taste', 'better', 'than', 'i', 'do', 'he', 'eats', 'a', 'lot', 'of', 'fish']",{'driver'},0
Do you happen to have a screw driver?,1.2470588235294118,0.05774929481166,85,68,13,4,do you happen to have a screw driver,286,"['do', 'you', 'happen', 'to', 'have', 'a', 'screw', 'driver']",{'driver'},0
The drivers I helped never complained.,1.2424242424242424,0.0538956692553624,99,80,14,5,the drivers i helped never complained,286,"['the', 'drivers', 'i', 'helped', 'never', 'complained']",{'driver'},0
I ate the AAA tow truck driver with some fava beans and a nice Chianti.,1.2417582417582418,0.0591776352432363,91,75,10,6,i ate the aaa tow truck driver with some fava beans and a nice chianti,286,"['i', 'ate', 'the', 'aaa', 'tow', 'truck', 'driver', 'with', 'some', 'fava', 'beans', 'and', 'a', 'nice', 'chianti']",{'driver'},-1
"If you behave yourself, you can ride with the tow truck driver.",1.23,0.0489382212074519,100,80,17,3,if you behave yourself you can ride with the tow truck driver,286,"['if', 'you', 'behave', 'yourself', 'you', 'can', 'ride', 'with', 'the', 'tow', 'truck', 'driver']",{'driver'},0
"Do you have a chew revivor, I mean screw driver, that I could borrow?",1.2252252252252251,0.0437487515856694,111,88,21,2,do you have a chew revivor i mean screw driver that i could borrow,286,"['do', 'you', 'have', 'a', 'chew', 'revivor', 'i', 'mean', 'screw', 'driver', 'that', 'i', 'could', 'borrow']",{'driver'},-1
"When you drove up, it sounded like your fan belt was loose, at least, that was the problem of the last driver I ate.",1.2212389380530972,0.0514248824267676,113,95,11,7,when you drove up it sounded like your fan belt was loose at least that was the problem of the last driver i ate,286,"['when', 'you', 'drove', 'up', 'it', 'sounded', 'like', 'your', 'fan', 'belt', 'was', 'loose', 'at', 'least', 'that', 'was', 'the', 'problem', 'of', 'the', 'last', 'driver', 'i', 'ate']",{'driver'},0
Delivery? Driver.,1.2093023255813953,0.0471232022332827,86,69,16,1,delivery driver,286,"['delivery', 'driver']",{'driver'},-1
"I'm here to notify you that I ate Triple-A driver. 
Your wait times are going to be another two lunches.",1.2037037037037035,0.0431521478914562,108,88,18,2,i am here to notify you that i ate triple a driver your wait times are going to be another two lunches,286,"['i', 'am', 'here', 'to', 'notify', 'you', 'that', 'i', 'ate', 'triple', 'a', 'driver', 'your', 'wait', 'times', 'are', 'going', 'to', 'be', 'another', 'two', 'lunches']",{'driver'},0
The driver's seat is coffee flavored.,1.202020202020202,0.0475753002073146,99,82,14,3,the driver s seat is coffee flavored,286,"['the', 'driver', 's', 'seat', 'is', 'coffee', 'flavored']",{'driver'},0
I’m actually going to fix this from the drivers side of the car if you don’t mind.,1.1898734177215189,0.0511977581586359,79,66,11,2,i am actually going to fix this from the drivers side of the car if you do not mind,286,"['i', 'am', 'actually', 'going', 'to', 'fix', 'this', 'from', 'the', 'drivers', 'side', 'of', 'the', 'car', 'if', 'you', 'do', 'not', 'mind']",{'driver'},0
When a 1-star driver meets a 1-star passenger.,1.1770833333333333,0.0444133091782603,96,81,13,2,when a 1 star driver meets a 1 star passenger,286,"['when', 'a', '1', 'star', 'driver', 'meets', 'a', '1', 'star', 'passenger']",{'driver'},0
"Don't worry, I only eat Tesla drivers.",1.1666666666666667,0.0462250163521024,78,66,11,1,do not worry i only eat tesla drivers,286,"['do', 'not', 'worry', 'i', 'only', 'eat', 'tesla', 'drivers']",{'driver'},0
Don't worry. I only eat Tesla Drivers. I can place the cars on self-drive and send them away while I enjoy the fresh meat.,1.163265306122449,0.0427683851428825,98,84,12,2,do not worry i only eat tesla drivers i can place the cars on self drive and send them away while i enjoy the fresh meat,286,"['do', 'not', 'worry', 'i', 'only', 'eat', 'tesla', 'drivers', 'i', 'can', 'place', 'the', 'cars', 'on', 'self', 'drive', 'and', 'send', 'them', 'away', 'while', 'i', 'enjoy', 'the', 'fresh', 'meat']",{'driver'},0
Goldilocks' Uber driver? No wonder she's late!,1.1538461538461535,0.041117114140373,91,78,12,1,goldilocks uber driver no wonder she is late,286,"['goldilocks', 'uber', 'driver', 'no', 'wonder', 'she', 'is', 'late']",{'driver'},0
My U-bear eats driver is finally here!,1.148648648648649,0.0458674766038889,74,64,9,1,my you bear eats driver is finally here,286,"['my', 'you', 'bear', 'eats', 'driver', 'is', 'finally', 'here']",{'driver'},0
"Don't worry, I 'm the Uber driver",1.1235955056179776,0.0385521439566202,89,79,9,1,do not worry i m the uber driver,286,"['do', 'not', 'worry', 'i', 'm', 'the', 'uber', 'driver']",{'driver'},0
...and the tow truck driver really jumped when he opened the hood and found me.,1.1139240506329111,0.0359745924087851,79,70,9,0,and the tow truck driver really jumped when he opened the hood and found me,286,"['and', 'the', 'tow', 'truck', 'driver', 'really', 'jumped', 'when', 'he', 'opened', 'the', 'hood', 'and', 'found', 'me']",{'driver'},0
I think you’re really not giving the dog enough credit. You’ve watched the same true crime documentaries as me: maybe the mailman really IS dangerous.,1.2673267326732671,0.0560959028681793,101,80,15,6,i think you are really not giving the dog enough credit you have watched the same true crime documentaries as me maybe the mailman really is dangerous,287,"['i', 'think', 'you', 'are', 'really', 'not', 'giving', 'the', 'dog', 'enough', 'credit', 'you', 'have', 'watched', 'the', 'same', 'true', 'crime', 'documentaries', 'as', 'me', 'maybe', 'the', 'mailman', 'really', 'is', 'dangerous']",{'mailman'},1
I thought you were the designated driver.,1.2258064516129032,0.0461946818846464,93,73,19,1,i thought you were the designated driver,287,"['i', 'thought', 'you', 'were', 'the', 'designated', 'driver']",{'driver'},0
"Put me in check all you want, the semi-truck driver is still gonna be lookin at his phone.",1.3612903225806452,0.0516861650131807,155,113,28,14,put me in check all you want the semi truck driver is still going to be lookin at his phone,289,"['put', 'me', 'in', 'check', 'all', 'you', 'want', 'the', 'semi', 'truck', 'driver', 'is', 'still', 'going', 'to', 'be', 'lookin', 'at', 'his', 'phone']",{'driver'},0
My next delivery is to a sailor and nurse in Times Square.,1.4626168224299063,0.0466510253329343,214,138,53,23,my next delivery is to a sailor and nurse in times square,290,"['my', 'next', 'delivery', 'is', 'to', 'a', 'sailor', 'and', 'nurse', 'in', 'times', 'square']",{'sailor'},0
That explains the shortage of pizza delivery drivers,1.3725490196078431,0.0539801726754262,153,112,25,16,that explains the shortage of pizza delivery drivers,290,"['that', 'explains', 'the', 'shortage', 'of', 'pizza', 'delivery', 'drivers']",{'driver'},0
"I found you because I'm the only driver with a DeLorean, but how did you call this in to the year 2022?",1.3636363636363635,0.0642234328651644,110,82,16,12,i found you because i am the only driver with a delorean but how did you call this in to the year 2022,290,"['i', 'found', 'you', 'because', 'i', 'am', 'the', 'only', 'driver', 'with', 'a', 'delorean', 'but', 'how', 'did', 'you', 'call', 'this', 'in', 'to', 'the', 'year', '2022']",{'driver'},0
Friendly reminder that a delivery charge is not a tip paid to your driver.,1.263157894736842,0.0631578947368421,76,60,12,4,friendly reminder that a delivery charge is not a tip paid to your driver,290,"['friendly', 'reminder', 'that', 'a', 'delivery', 'charge', 'is', 'not', 'a', 'tip', 'paid', 'to', 'your', 'driver']",{'driver'},0
This is the last time; we're running out of delivery drivers.,1.2394366197183098,0.0583639753156484,71,56,13,2,this is the last time we are running out of delivery drivers,290,"['this', 'is', 'the', 'last', 'time', 'we', 'are', 'running', 'out', 'of', 'delivery', 'drivers']",{'driver'},0
"As the only Uber driver in town to do this, I expect a big tip.",1.2023809523809523,0.055608463182317,84,71,9,4,as the only uber driver in town to do this i expect a big tip,290,"['as', 'the', 'only', 'uber', 'driver', 'in', 'town', 'to', 'do', 'this', 'i', 'expect', 'a', 'big', 'tip']",{'driver'},0
"Neither rain, nor sleet, nor height and danger of building shall stay these pizza couriers from the swift  completion of providing mouth watering pie.” The pizza delivery pledge",1.1875,0.0473799281862764,80,66,13,1,neither rain nor sleet nor height and danger of building shall stay these pizza couriers from the swift completion of providing mouth watering pie ” the pizza delivery pledge,290,"['neither', 'rain', 'nor', 'sleet', 'nor', 'height', 'and', 'danger', 'of', 'building', 'shall', 'stay', 'these', 'pizza', 'couriers', 'from', 'the', 'swift', 'completion', 'of', 'providing', 'mouth', 'watering', 'pie', '”', 'the', 'pizza', 'delivery', 'pledge']",{'courier'},-1
I’m really having my doubts about this whole pizza oven on the end of the beam and assembly line to driver delivery system… anyways where am i taking this pie???,1.126984126984127,0.0479591879966097,63,56,6,1,i am really having my doubts about this whole pizza oven on the end of the beam and assembly line to driver delivery system… anyways where am i taking this pie,290,"['i', 'am', 'really', 'having', 'my', 'doubts', 'about', 'this', 'whole', 'pizza', 'oven', 'on', 'the', 'end', 'of', 'the', 'beam', 'and', 'assembly', 'line', 'to', 'driver', 'delivery', 'system…', 'anyways', 'where', 'am', 'i', 'taking', 'this', 'pie']",{'driver'},-1
It’s perfect for a first time driver,1.7173423423423424,0.0177401932771439,1776,818,642,316,it is perfect for a first time driver,291,"['it', 'is', 'perfect', 'for', 'a', 'first', 'time', 'driver']",{'driver'},0
This is the perfect car for the first-time driver.,1.5555555555555556,0.0388324744455419,360,213,94,53,this is the perfect car for the first time driver,291,"['this', 'is', 'the', 'perfect', 'car', 'for', 'the', 'first', 'time', 'driver']",{'driver'},0
The only emissions are the curses from the drivers behind you.,1.514388489208633,0.0413147884866561,278,166,81,31,the only emissions are the curses from the drivers behind you,291,"['the', 'only', 'emissions', 'are', 'the', 'curses', 'from', 'the', 'drivers', 'behind', 'you']",{'driver'},0
The emissions depend on the driver.,1.5063291139240509,0.0484399598083504,237,153,48,36,the emissions depend on the driver,291,"['the', 'emissions', 'depend', 'on', 'the', 'driver']",{'driver'},0
It's our most popular model ...it totally eliminates backseat drivers.,1.4404145077720207,0.0474878310358118,193,126,49,18,it is our most popular model it totally eliminates backseat drivers,291,"['it', 'is', 'our', 'most', 'popular', 'model', 'it', 'totally', 'eliminates', 'backseat', 'drivers']",{'driver'},0
It’s perfect for first-time drivers.,1.4393939393939394,0.0460657264456935,198,128,53,17,it is perfect for first time drivers,291,"['it', 'is', 'perfect', 'for', 'first', 'time', 'drivers']",{'driver'},0
This one is the perfect starter car for any new driver in the family!,1.432098765432099,0.0494401935268971,162,104,46,12,this one is the perfect starter car for any new driver in the family,291,"['this', 'one', 'is', 'the', 'perfect', 'starter', 'car', 'for', 'any', 'new', 'driver', 'in', 'the', 'family']","{'driver', 'starter'}",0
"And, you'll never have to worry about 'backseat drivers' again.",1.4246575342465753,0.0556964039518301,146,99,32,15,and you will never have to worry about backseat drivers again,291,"['and', 'you', 'will', 'never', 'have', 'to', 'worry', 'about', 'backseat', 'drivers', 'again']",{'driver'},0
"Most drivers are happy, except at nap time.",1.4097222222222223,0.0496815758473465,144,93,43,8,most drivers are happy except at nap time,291,"['most', 'drivers', 'are', 'happy', 'except', 'at', 'nap', 'time']",{'driver'},0
It does take a discriminating driver to appreciate the benefits of a car that can be repaired with crazy glue.,1.4,0.0521565577220157,145,98,36,11,it does take a discriminating driver to appreciate the benefits of a car that can be repaired with crazy glue,291,"['it', 'does', 'take', 'a', 'discriminating', 'driver', 'to', 'appreciate', 'the', 'benefits', 'of', 'a', 'car', 'that', 'can', 'be', 'repaired', 'with', 'crazy', 'glue']",{'driver'},0
This is a great vehicle for a young driver.,1.381679389312977,0.0567861264175894,131,93,26,12,this is a great vehicle for a young driver,291,"['this', 'is', 'a', 'great', 'vehicle', 'for', 'a', 'young', 'driver']",{'driver'},0
No driver's license? No problem.,1.3525179856115108,0.049880797698038,139,98,33,8,no driver s license no problem,291,"['no', 'driver', 's', 'license', 'no', 'problem']",{'driver'},0
"It's a Popemobile for non-pope drivers.""it gives you the feeling without the mass.",1.3364485981308412,0.0607713964193289,107,82,15,10,it is a popemobile for non pope drivers it gives you the feeling without the mass,291,"['it', 'is', 'a', 'popemobile', 'for', 'non', 'pope', 'drivers', 'it', 'gives', 'you', 'the', 'feeling', 'without', 'the', 'mass']",{'driver'},0
This is a popular model for first time drivers.,1.3176470588235294,0.0652763243224822,85,64,15,6,this is a popular model for first time drivers,291,"['this', 'is', 'a', 'popular', 'model', 'for', 'first', 'time', 'drivers']",{'driver'},-1
Voted best car by the youngest of drivers!,1.310077519379845,0.0489700727460979,129,95,28,6,voted best car by the youngest of drivers,291,"['voted', 'best', 'car', 'by', 'the', 'youngest', 'of', 'drivers']",{'driver'},0
Only one driver - he babied it.,1.3095238095238095,0.063318514004789,84,63,16,5,only one driver he babied it,291,"['only', 'one', 'driver', 'he', 'babied', 'it']",{'driver'},0
It carries six clowns and a driver and is the official car of the Republican primaries!,1.3095238095238095,0.0697840914084955,84,66,10,8,it carries six clowns and a driver and is the official car of the republican primaries,291,"['it', 'carries', 'six', 'clowns', 'and', 'a', 'driver', 'and', 'is', 'the', 'official', 'car', 'of', 'the', 'republican', 'primaries']","{'driver', 'clown'}",0
The previous driver got a time-out and had to sell.,1.309278350515464,0.0610630778141472,97,74,16,7,the previous driver got a time out and had to sell,291,"['the', 'previous', 'driver', 'got', 'a', 'time', 'out', 'and', 'had', 'to', 'sell']",{'driver'},0
Perfect for student drivers.,1.3058823529411765,0.0555681866236425,85,61,22,2,perfect for student drivers,291,"['perfect', 'for', 'student', 'drivers']",{'driver'},0
It seats the driver and 32 clowns.,1.3,0.0678729811709616,90,72,9,9,it seats the driver and 32 clowns,291,"['it', 'seats', 'the', 'driver', 'and', '32', 'clowns']","{'driver', 'clown'}",0
Be your own designated driver.,1.2897196261682242,0.0547663731950382,107,82,19,6,be your own designated driver,291,"['be', 'your', 'own', 'designated', 'driver']",{'driver'},0
Great for beginner drivers.,1.287037037037037,0.0589085655413319,108,86,13,9,great for beginner drivers,291,"['great', 'for', 'beginner', 'drivers']",{'driver'},0
And here's our best seller for the Gen-x driver with a mid-teen crisis.,1.2795698924731185,0.0558950951678806,93,71,18,4,and here is our best seller for the gen x driver with a mid teen crisis,291,"['and', 'here', 'is', 'our', 'best', 'seller', 'for', 'the', 'gen', 'x', 'driver', 'with', 'a', 'mid', 'teen', 'crisis']","{'driver', 'seller'}",0
Great for new drivers.,1.279279279279279,0.0530343346378408,111,86,19,6,great for new drivers,291,"['great', 'for', 'new', 'drivers']",{'driver'},0
Perk: You don't need a driver's license.,1.2777777777777777,0.0632400543072825,72,55,14,3,perk you do not need a driver s license,291,"['perk', 'you', 'do', 'not', 'need', 'a', 'driver', 's', 'license']",{'driver'},0
