caption,mean,precision,votes,not_funny,somewhat_funny,funny,cleaned_caption_v2,contest_id,tokens,occupations,topic
The driver kept blowing his horn at me!,1.2357723577235773,0.044833426078803,123,98,21,4,the driver kept blowing his horn at me,177,"['the', 'driver', 'kept', 'blowing', 'his', 'horn', 'at', 'me']",{'driver'},0
"My bad, officer, but the driver called me a 'prick'""",1.2314049586776858,0.0508337247582532,121,101,12,8,my bad officer but the driver called me a prick,177,"['my', 'bad', 'officer', 'but', 'the', 'driver', 'called', 'me', 'a', 'prick']",{'driver'},0
I thought the driver was a Democrat!,1.2314049586776858,0.0494603530715854,121,100,14,7,i thought the driver was a democrat,177,"['i', 'thought', 'the', 'driver', 'was', 'a', 'democrat']",{'driver'},0
"It had no driver, so I had to stop it!",1.2314049586776858,0.0480477416652847,121,99,16,6,it had no driver so i had to stop it,177,"['it', 'had', 'no', 'driver', 'so', 'i', 'had', 'to', 'stop', 'it']",{'driver'},0
The driver of this car keeps getting his captions rejected.,1.228813559322034,0.0472494450837292,118,96,17,5,the driver of this car keeps getting his captions rejected,177,"['the', 'driver', 'of', 'this', 'car', 'keeps', 'getting', 'his', 'captions', 'rejected']",{'driver'},0
the door belongs to Hubie the evil cab driver.,1.2241379310344829,0.0442939054436728,116,93,20,3,the door belongs to hubie the evil cab driver,177,"['the', 'door', 'belongs', 'to', 'hubie', 'the', 'evil', 'cab', 'driver']",{'driver'},0
The stupid driver opened his door without looking.,1.2212389380530972,0.0465879286287946,113,92,17,4,the stupid driver opened his door without looking,177,"['the', 'stupid', 'driver', 'opened', 'his', 'door', 'without', 'looking']",{'driver'},0
I was aiming for the side mirror when the driver opened the door.,1.2162162162162162,0.0432227633731657,111,89,20,2,i was aiming for the side mirror when the driver opened the door,177,"['i', 'was', 'aiming', 'for', 'the', 'side', 'mirror', 'when', 'the', 'driver', 'opened', 'the', 'door']",{'driver'},0
"The driver said, ""Surely you joust."" I got upset...",1.2162162162162162,0.0450777931737218,111,90,18,3,the driver said surely you joust i got upset,177,"['the', 'driver', 'said', 'surely', 'you', 'joust', 'i', 'got', 'upset']",{'driver'},0
Sorry officer. The driver didn’t look when he opened the door.,1.211009174311927,0.0452902342334822,109,89,17,3,sorry officer the driver did not look when he opened the door,177,"['sorry', 'officer', 'the', 'driver', 'did', 'not', 'look', 'when', 'he', 'opened', 'the', 'door']",{'driver'},0
Forsooth. No Uber driver steals my fare.,1.2075471698113207,0.0478034707076139,106,88,14,4,forsooth no uber driver steals my fare,177,"['forsooth', 'no', 'uber', 'driver', 'steals', 'my', 'fare']",{'driver'},0
''Does thou expect'th me not to attack'th a driver on thy phone?'',1.2075471698113207,0.0438837415572029,106,86,18,2,does thou expect th me not to attack th a driver on thy phone,177,"['does', 'thou', 'expect', 'th', 'me', 'not', 'to', 'attack', 'th', 'a', 'driver', 'on', 'thy', 'phone']",{'driver'},0
I was riding in the bike lane when the driver suddenly opened the door.,1.2075471698113207,0.0417862208597789,106,85,20,1,i was riding in the bike lane when the driver suddenly opened the door,177,"['i', 'was', 'riding', 'in', 'the', 'bike', 'lane', 'when', 'the', 'driver', 'suddenly', 'opened', 'the', 'door']",{'driver'},0
"Clearly, Sir, the driver needed to yield!""",1.203883495145631,0.0465018914581891,103,85,15,3,clearly sir the driver needed to yield,177,"['clearly', 'sir', 'the', 'driver', 'needed', 'to', 'yield']",{'driver'},0
"“Not my fault, the driver opened  his door in traffic”.",1.198019801980198,0.0467133707409324,101,84,14,3,“ not my fault the driver opened his door in traffic ”,177,"['“', 'not', 'my', 'fault', 'the', 'driver', 'opened', 'his', 'door', 'in', 'traffic', '”']",{'driver'},0
The driver opened the door to block my road rage but the VIN number is on the decal.,1.198019801980198,0.0487868712663561,101,85,12,4,the driver opened the door to block my road rage but the vin number is on the decal,177,"['the', 'driver', 'opened', 'the', 'door', 'to', 'block', 'my', 'road', 'rage', 'but', 'the', 'vin', 'number', 'is', 'on', 'the', 'decal']",{'driver'},0
I've had it with those lousy Lyft drivers!,1.198019801980198,0.050775767940428,101,86,10,5,i have had it with those lousy lyft drivers,177,"['i', 'have', 'had', 'it', 'with', 'those', 'lousy', 'lyft', 'drivers']",{'driver'},0
I simply gave the driver a tip.,1.1938775510204085,0.0426804488783102,98,80,17,1,i simply gave the driver a tip,177,"['i', 'simply', 'gave', 'the', 'driver', 'a', 'tip']",{'driver'},0
"The driver was so smug bragging about his ""zero emissions"" vehicle. Elmer here just ate lunch; his digestive system shall not be besmirched!",1.1938775510204085,0.0516061474957516,98,84,9,5,the driver was so smug bragging about his zero emissions vehicle elmer here just ate lunch his digestive system shall not be besmirched,177,"['the', 'driver', 'was', 'so', 'smug', 'bragging', 'about', 'his', 'zero', 'emissions', 'vehicle', 'elmer', 'here', 'just', 'ate', 'lunch', 'his', 'digestive', 'system', 'shall', 'not', 'be', 'besmirched']",{'driver'},0
Got  the door but missed the driver.,1.1938775510204085,0.0450778676534156,98,81,15,2,got the door but missed the driver,177,"['got', 'the', 'door', 'but', 'missed', 'the', 'driver']",{'driver'},0
Uber driver !,1.1875,0.0498077444129803,96,82,10,4,uber driver,177,"['uber', 'driver']",{'driver'},0
"Back seat driver, Officer.",1.1777777777777778,0.0434980384070691,90,75,14,1,back seat driver officer,177,"['back', 'seat', 'driver', 'officer']",{'driver'},0
I think you should write the driver of the car a ticket for Failure to Observe an Active Jousting Lane.”,1.1777777777777778,0.0462792311453009,90,76,12,2,i think you should write the driver of the car a ticket for failure to observe an active jousting lane ”,177,"['i', 'think', 'you', 'should', 'write', 'the', 'driver', 'of', 'the', 'car', 'a', 'ticket', 'for', 'failure', 'to', 'observe', 'an', 'active', 'jousting', 'lane', '”']",{'driver'},0
"Officer, I took care of the driver's road rage!",1.1724137931034482,0.0468377070002293,87,74,11,2,officer i took care of the driver s road rage,177,"['officer', 'i', 'took', 'care', 'of', 'the', 'driver', 's', 'road', 'rage']",{'driver'},0
"See, those taxi drivers are trying to block our new business model",1.1724137931034482,0.0468377070002293,87,74,11,2,see those taxi drivers are trying to block our new business model,177,"['see', 'those', 'taxi', 'drivers', 'are', 'trying', 'to', 'block', 'our', 'new', 'business', 'model']",{'driver'},0
This is the passenger side door.  The driver got away.,1.1704545454545454,0.0403148233467071,88,73,15,0,this is the passenger side door the driver got away,177,"['this', 'is', 'the', 'passenger', 'side', 'door', 'the', 'driver', 'got', 'away']",{'driver'},0
I am on a noble mission to chastise an errant Uber Driver,1.1704545454545454,0.0463438347699413,88,75,11,2,i am on a noble mission to chastise an errant uber driver,177,"['i', 'am', 'on', 'a', 'noble', 'mission', 'to', 'chastise', 'an', 'errant', 'uber', 'driver']",{'driver'},0
"Drop your weapon, get off your horse, and show me your drivers license.",1.1647058823529413,0.0497811986364662,85,74,8,3,drop your weapon get off your horse and show me your drivers license,177,"['drop', 'your', 'weapon', 'get', 'off', 'your', 'horse', 'and', 'show', 'me', 'your', 'drivers', 'license']",{'driver'},0
"Driver's side front door, yep, that""s a $250 ticket",1.1647058823529413,0.0468834266331438,85,73,10,2,driver s side front door yep that s a 250 ticket,177,"['driver', 's', 'side', 'front', 'door', 'yep', 'that', 's', 'a', '250', 'ticket']",{'driver'},0
"Officer, I admit I was mad when the Uber driver said he would meet me at the moat and then was late.",1.1647058823529413,0.0525193277042008,85,75,6,4,officer i admit i was mad when the uber driver said he would meet me at the moat and then was late,177,"['officer', 'i', 'admit', 'i', 'was', 'mad', 'when', 'the', 'uber', 'driver', 'said', 'he', 'would', 'meet', 'me', 'at', 'the', 'moat', 'and', 'then', 'was', 'late']",{'driver'},-1
I'll return with driver soon.,1.1647058823529413,0.0437943335152785,85,72,12,1,i will return with driver soon,177,"['i', 'will', 'return', 'with', 'driver', 'soon']",{'driver'},0
I was playing with the driver of a Mustang.,1.1647058823529413,0.0437943335152785,85,72,12,1,i was playing with the driver of a mustang,177,"['i', 'was', 'playing', 'with', 'the', 'driver', 'of', 'a', 'mustang']",{'driver'},0
"It's because of drivers like these that I gave up on riding my bike to work, officer. Nobody bothers to look before opening their door!",1.1647058823529413,0.0468834266331438,85,73,10,2,it is because of drivers like these that i gave up on riding my bike to work officer nobody bothers to look before opening their door,177,"['it', 'is', 'because', 'of', 'drivers', 'like', 'these', 'that', 'i', 'gave', 'up', 'on', 'riding', 'my', 'bike', 'to', 'work', 'officer', 'nobody', 'bothers', 'to', 'look', 'before', 'opening', 'their', 'door']",{'driver'},0
"Blame the driver, not the lance!",1.1518987341772151,0.0444542352441043,79,68,10,1,blame the driver not the lance,177,"['blame', 'the', 'driver', 'not', 'the', 'lance']",{'driver'},0
"I took care of charging the other driver, officer.",1.1518987341772151,0.0444542352441043,79,68,10,1,i took care of charging the other driver officer,177,"['i', 'took', 'care', 'of', 'charging', 'the', 'other', 'driver', 'officer']",{'driver'},0
Sorry. I was aiming for the driver and missed.,1.144736842105263,0.0406264427259979,76,65,11,0,sorry i was aiming for the driver and missed,177,"['sorry', 'i', 'was', 'aiming', 'for', 'the', 'driver', 'and', 'missed']",{'driver'},0
The driver ran a red light and hit me .,1.144736842105263,0.0485001261290494,76,67,7,2,the driver ran a red light and hit me,177,"['the', 'driver', 'ran', 'a', 'red', 'light', 'and', 'hit', 'me']",{'driver'},0
I warned the Uber driver to have passengers use the curb side only.,1.135135135135135,0.0443986698267628,74,65,8,1,i warned the uber driver to have passengers use the curb side only,177,"['i', 'warned', 'the', 'uber', 'driver', 'to', 'have', 'passengers', 'use', 'the', 'curb', 'side', 'only']",{'driver'},0
The driver had it coming to him but the door got in the way.,1.1176470588235294,0.0492677360723378,68,62,4,2,the driver had it coming to him but the door got in the way,177,"['the', 'driver', 'had', 'it', 'coming', 'to', 'him', 'but', 'the', 'door', 'got', 'in', 'the', 'way']",{'driver'},-1
What could I do? The pace-car driver at the joust opened his door.,1.1176470588235294,0.0393617414775415,68,60,8,0,what could i do the pace car driver at the joust opened his door,177,"['what', 'could', 'i', 'do', 'the', 'pace', 'car', 'driver', 'at', 'the', 'joust', 'opened', 'his', 'door']",{'driver'},-1
"I didn't get a good look at the driver, but he was in a Mustang.",1.1076923076923078,0.0445224496261162,65,59,5,1,i did not get a good look at the driver but he was in a mustang,177,"['i', 'did', 'not', 'get', 'a', 'good', 'look', 'at', 'the', 'driver', 'but', 'he', 'was', 'in', 'a', 'mustang']",{'driver'},0
The driver said I had no horse power.,1.1076923076923078,0.0445224496261162,65,59,5,1,the driver said i had no horse power,177,"['the', 'driver', 'said', 'i', 'had', 'no', 'horse', 'power']",{'driver'},0
"No, the driver fell off a couple of blocks back.",1.096774193548387,0.0378541092928044,62,56,6,0,no the driver fell off a couple of blocks back,177,"['no', 'the', 'driver', 'fell', 'off', 'a', 'couple', 'of', 'blocks', 'back']",{'driver'},0
"Officer I was riding my horse 35 mph. I
did not see the driver ahead of me!",1.096774193548387,0.0442916958370775,62,57,4,1,officer i was riding my horse 35 mph i did not see the driver ahead of me,177,"['officer', 'i', 'was', 'riding', 'my', 'horse', '35', 'mph', 'i', 'did', 'not', 'see', 'the', 'driver', 'ahead', 'of', 'me']",{'driver'},0
I do apologize constable; I’m not a great  night driver”,1.096774193548387,0.0442916958370775,62,57,4,1,i do apologize constable i am not a great night driver ”,177,"['i', 'do', 'apologize', 'constable', 'i', 'am', 'not', 'a', 'great', 'night', 'driver', '”']","{'driver', 'constable'}",0
"Sir, where is your seatbelt? Were you speeding? Where the driver if the other vehicle?",1.096774193548387,0.0442916958370775,62,57,4,1,sir where is your seatbelt were you speeding where the driver if the other vehicle,177,"['sir', 'where', 'is', 'your', 'seatbelt', 'were', 'you', 'speeding', 'where', 'the', 'driver', 'if', 'the', 'other', 'vehicle']",{'driver'},0
Freeway...the damn driver was in a Charger coming at me at 80 miles per hour...,1.096774193548387,0.0442916958370775,62,57,4,1,freeway the damn driver was in a charger coming at me at 80 miles per hour,177,"['freeway', 'the', 'damn', 'driver', 'was', 'in', 'a', 'charger', 'coming', 'at', 'me', 'at', '80', 'miles', 'per', 'hour']","{'driver', 'charger'}",0
That smug Prius driver told me his mode of transportation was more eco-friendly than mine.  I told him to recycle this!,1.096774193548387,0.0378541092928044,62,56,6,0,that smug prius driver told me his mode of transportation was more eco friendly than mine i told him to recycle this,177,"['that', 'smug', 'prius', 'driver', 'told', 'me', 'his', 'mode', 'of', 'transportation', 'was', 'more', 'eco', 'friendly', 'than', 'mine', 'i', 'told', 'him', 'to', 'recycle', 'this']",{'driver'},0
"No officer, I wasn’t jousting without a license: he just opened the driver’s side door on to traffic  as I was about to pass him.",1.096774193548387,0.0378541092928044,62,56,6,0,no officer i was not jousting without a license he just opened the driver ’ s side door on to traffic as i was about to pass him,177,"['no', 'officer', 'i', 'was', 'not', 'jousting', 'without', 'a', 'license', 'he', 'just', 'opened', 'the', 'driver', '’', 's', 'side', 'door', 'on', 'to', 'traffic', 'as', 'i', 'was', 'about', 'to', 'pass', 'him']",{'driver'},0
"I didn't get a look at the driver, but the car was definitely a Lancia.",1.096774193548387,0.0442916958370775,62,57,4,1,i did not get a look at the driver but the car was definitely a lancia,177,"['i', 'did', 'not', 'get', 'a', 'look', 'at', 'the', 'driver', 'but', 'the', 'car', 'was', 'definitely', 'a', 'lancia']",{'driver'},0
"Something gets into me, I confess, when uncouth drivers make canned ham jokes.",1.096774193548387,0.0442916958370775,62,57,4,1,something gets into me i confess when uncouth drivers make canned ham jokes,177,"['something', 'gets', 'into', 'me', 'i', 'confess', 'when', 'uncouth', 'drivers', 'make', 'canned', 'ham', 'jokes']",{'driver'},0
"Sir, I was in the designated jousting lane when the driver opened his door.",1.096774193548387,0.0442916958370775,62,57,4,1,sir i was in the designated jousting lane when the driver opened his door,177,"['sir', 'i', 'was', 'in', 'the', 'designated', 'jousting', 'lane', 'when', 'the', 'driver', 'opened', 'his', 'door']",{'driver'},0
The driver was a real dork!,1.096774193548387,0.0378541092928044,62,56,6,0,the driver was a real dork,177,"['the', 'driver', 'was', 'a', 'real', 'dork']",{'driver'},0
I was just riding along minding my own business and the car door opened without the driver looking.,1.0862068965517242,0.0371755596799843,58,53,5,0,i was just riding along minding my own business and the car door opened without the driver looking,177,"['i', 'was', 'just', 'riding', 'along', 'minding', 'my', 'own', 'business', 'and', 'the', 'car', 'door', 'opened', 'without', 'the', 'driver', 'looking']",{'driver'},0
He drove a made-for-America MG.Otherwise I would have murdered the driver.,1.0862068965517242,0.044575586536534,58,54,3,1,he drove a made for america mg otherwise i would have murdered the driver,177,"['he', 'drove', 'a', 'made', 'for', 'america', 'mg', 'otherwise', 'i', 'would', 'have', 'murdered', 'the', 'driver']",{'driver'},0
The car driver is receiving a ticket for opening the door without looking in the rear mirror first.,1.0727272727272728,0.0438435038670923,55,52,2,1,the car driver is receiving a ticket for opening the door without looking in the rear mirror first,177,"['the', 'car', 'driver', 'is', 'receiving', 'a', 'ticket', 'for', 'opening', 'the', 'door', 'without', 'looking', 'in', 'the', 'rear', 'mirror', 'first']",{'driver'},0
"By natural law I shouldn't be able to hold this with one arm. The driver was honking at my pet aardvark and I wasn't having it! Have you seen my horse? Oh, wait, she's under me. So, how long have you worked at the mall?  Burp! I'm a knight!",1.0727272727272728,0.0353391023930018,55,51,4,0,by natural law i should not be able to hold this with one arm the driver was honking at my pet aardvark and i was not having it have you seen my horse oh wait she is under me so how long have you worked at the mall burp i am a knight,177,"['by', 'natural', 'law', 'i', 'should', 'not', 'be', 'able', 'to', 'hold', 'this', 'with', 'one', 'arm', 'the', 'driver', 'was', 'honking', 'at', 'my', 'pet', 'aardvark', 'and', 'i', 'was', 'not', 'having', 'it', 'have', 'you', 'seen', 'my', 'horse', 'oh', 'wait', 'she', 'is', 'under', 'me', 'so', 'how', 'long', 'have', 'you', 'worked', 'at', 'the', 'mall', 'burp', 'i', 'am', 'a', 'knight']",{'driver'},0
"Officer, taxi travel was just simply too slow in this holiday traffic, traveling by horse is much quicker. The taxi drove away and my foil foiled the driver's day for sure.",1.0727272727272728,0.0353391023930018,55,51,4,0,officer taxi travel was just simply too slow in this holiday traffic traveling by horse is much quicker the taxi drove away and my foil foiled the driver s day for sure,177,"['officer', 'taxi', 'travel', 'was', 'just', 'simply', 'too', 'slow', 'in', 'this', 'holiday', 'traffic', 'traveling', 'by', 'horse', 'is', 'much', 'quicker', 'the', 'taxi', 'drove', 'away', 'and', 'my', 'foil', 'foiled', 'the', 'driver', 's', 'day', 'for', 'sure']",{'driver'},0
Never joust with an Uber driver?,1.0727272727272728,0.0353391023930018,55,51,4,0,never joust with an uber driver,177,"['never', 'joust', 'with', 'an', 'uber', 'driver']",{'driver'},0
"The driver failed to employ the Dutch Reach, but I was ready.",1.022222222222222,0.0224733287487747,45,44,1,0,the driver failed to employ the dutch reach but i was ready,177,"['the', 'driver', 'failed', 'to', 'employ', 'the', 'dutch', 'reach', 'but', 'i', 'was', 'ready']",{'driver'},0
"It's cool, the driver was black!",1.0217391304347827,0.0219793491131929,46,45,1,0,it is cool the driver was black,177,"['it', 'is', 'cool', 'the', 'driver', 'was', 'black']",{'driver'},0
He asked for a Uber driver  not a scuba diver,1.2222222222222223,0.1469861839480327,9,7,2,0,he asked for a uber driver not a scuba diver,178,"['he', 'asked', 'for', 'a', 'uber', 'driver', 'not', 'a', 'scuba', 'diver']","{'driver', 'diver'}",-1
"Yes, it was driver-less smarty!   The landing capsule is being picked up from the roof  by Elon Musk.",1.0,0.1543033499620919,7,7,0,0,yes it was driver less smarty the landing capsule is being picked up from the roof by elon musk,178,"['yes', 'it', 'was', 'driver', 'less', 'smarty', 'the', 'landing', 'capsule', 'is', 'being', 'picked', 'up', 'from', 'the', 'roof', 'by', 'elon', 'musk']",{'driver'},0
"Can you talk loader?”
Don Dechman, Austin, T",1.0,0.2236067977499789,5,5,0,0,can you talk loader ” don dechman austin t,178,"['can', 'you', 'talk', 'loader', '”', 'don', 'dechman', 'austin', 't']",{'loader'},-1
the door belongs to Hubie the evil cab driver,1.0,0.1825741858350553,6,6,0,0,the door belongs to hubie the evil cab driver,178,"['the', 'door', 'belongs', 'to', 'hubie', 'the', 'evil', 'cab', 'driver']",{'driver'},0
"Safe travels out there, sir.  There are a lot of crazy drivers on the freeway.",1.0,0.1825741858350553,6,6,0,0,safe travels out there sir there are a lot of crazy drivers on the freeway,178,"['safe', 'travels', 'out', 'there', 'sir', 'there', 'are', 'a', 'lot', 'of', 'crazy', 'drivers', 'on', 'the', 'freeway']",{'driver'},0
"Yeah, that sounds exciting, I guess. While you were at the International Space Station I got the new Disney streaming service and I got kicked off GrubHub for insisting the delivery drivers feed me the food like I’m a baby bird",1.0,0.1178511301977579,9,9,0,0,yeah that sounds exciting i guess while you were at the international space station i got the new disney streaming service and i got kicked off grubhub for insisting the delivery drivers feed me the food like i am a baby bird,178,"['yeah', 'that', 'sounds', 'exciting', 'i', 'guess', 'while', 'you', 'were', 'at', 'the', 'international', 'space', 'station', 'i', 'got', 'the', 'new', 'disney', 'streaming', 'service', 'and', 'i', 'got', 'kicked', 'off', 'grubhub', 'for', 'insisting', 'the', 'delivery', 'drivers', 'feed', 'me', 'the', 'food', 'like', 'i', 'am', 'a', 'baby', 'bird']",{'driver'},0
"Babe, are you sure you don't want to watch? Adam Driver is supposed to be truly incredible in this.",1.0714285714285714,0.0347266024860284,56,52,4,0,babe are you sure you do not want to watch adam driver is supposed to be truly incredible in this,179,"['babe', 'are', 'you', 'sure', 'you', 'do', 'not', 'want', 'to', 'watch', 'adam', 'driver', 'is', 'supposed', 'to', 'be', 'truly', 'incredible', 'in', 'this']",{'driver'},0
It's a song about a middle-aged man who slips on the ice and breaks his back on the same day his wife leaves him for a snowplow driver.,1.2760416666666667,0.041240113200732,192,151,29,12,it is a song about a middle aged man who slips on the ice and breaks his back on the same day his wife leaves him for a snowplow driver,182,"['it', 'is', 'a', 'song', 'about', 'a', 'middle', 'aged', 'man', 'who', 'slips', 'on', 'the', 'ice', 'and', 'breaks', 'his', 'back', 'on', 'the', 'same', 'day', 'his', 'wife', 'leaves', 'him', 'for', 'a', 'snowplow', 'driver']",{'driver'},0
"It's normal if a lowly maitre d' wears a bowtie, but when anyone else does it, it just indicates that they're a clown or an ice cream truck driver or a pedophile.",1.0,0.2236067977499789,5,5,0,0,it is normal if a lowly maitre d wears a bowtie but when anyone else does it it just indicates that they are a clown or an ice cream truck driver or a pedophile,183,"['it', 'is', 'normal', 'if', 'a', 'lowly', 'maitre', 'd', 'wears', 'a', 'bowtie', 'but', 'when', 'anyone', 'else', 'does', 'it', 'it', 'just', 'indicates', 'that', 'they', 'are', 'a', 'clown', 'or', 'an', 'ice', 'cream', 'truck', 'driver', 'or', 'a', 'pedophile']","{'driver', 'clown'}",-1
"Walk the plank. Then go to your left and get us some fries, you free-loader",1.22,0.0388538246096944,150,121,25,4,walk the plank then go to your left and get us some fries you free loader,185,"['walk', 'the', 'plank', 'then', 'go', 'to', 'your', 'left', 'and', 'get', 'us', 'some', 'fries', 'you', 'free', 'loader']",{'loader'},-1
Let's see if he can swear like a sailor.,1.2137931034482758,0.0417369601272765,145,120,19,6,let us see if he can swear like a sailor,185,"['let', 'us', 'see', 'if', 'he', 'can', 'swear', 'like', 'a', 'sailor']",{'sailor'},0
"Aye, you'll get off at Bowery and show the new line, 
Ponywalk it sailor PonyWalk!",1.1904761904761905,0.0446706262840326,126,108,12,6,aye you will get off at bowery and show the new line ponywalk it sailor ponywalk,185,"['aye', 'you', 'will', 'get', 'off', 'at', 'bowery', 'and', 'show', 'the', 'new', 'line', 'ponywalk', 'it', 'sailor', 'ponywalk']",{'sailor'},0
"Again. We don't care if the Agency said they were sending ""pilots"" for your kids party",1.1382978723404256,0.041701030432061,94,83,9,2,again we do not care if the agency said they were sending pilots for your kids party,185,"['again', 'we', 'do', 'not', 'care', 'if', 'the', 'agency', 'said', 'they', 'were', 'sending', 'pilots', 'for', 'your', 'kids', 'party']",{'pilot'},0
"Arr, mateys, 'tis a bloody rotten navigator he turned out to be!",1.1382978723404256,0.041701030432061,94,83,9,2,arr mateys it is a bloody rotten navigator he turned out to be,185,"['arr', 'mateys', 'it', 'is', 'a', 'bloody', 'rotten', 'navigator', 'he', 'turned', 'out', 'to', 'be']",{'navigator'},0
Of course we can't get a cab - the drivers know you don't carry cash.,1.3414634146341464,0.0437640627055543,205,152,36,17,of course we can not get a cab the drivers know you do not carry cash,186,"['of', 'course', 'we', 'can', 'not', 'get', 'a', 'cab', 'the', 'drivers', 'know', 'you', 'do', 'not', 'carry', 'cash']",{'driver'},0
"I know it’s just honorary, but it seems like it should at least come with a car and driver.",1.3067484662576687,0.0446580486820973,163,122,32,9,i know it is just honorary but it seems like it should at least come with a car and driver,186,"['i', 'know', 'it', 'is', 'just', 'honorary', 'but', 'it', 'seems', 'like', 'it', 'should', 'at', 'least', 'come', 'with', 'a', 'car', 'and', 'driver']",{'driver'},0
"Don’t be sad, not every Uber driver has Camelot on their GPS.",1.274074074074074,0.0438975006303925,135,102,29,4,do not be sad not every uber driver has camelot on their gps,186,"['do', 'not', 'be', 'sad', 'not', 'every', 'uber', 'driver', 'has', 'camelot', 'on', 'their', 'gps']",{'driver'},0
"It doesn't matter, you can't talk to the Uber driver like that.",1.256198347107438,0.0431681407682529,121,92,27,2,it does not matter you can not talk to the uber driver like that,186,"['it', 'does', 'not', 'matter', 'you', 'can', 'not', 'talk', 'to', 'the', 'uber', 'driver', 'like', 'that']",{'driver'},0
