caption,mean,precision,votes,not_funny,somewhat_funny,funny,cleaned_caption_v2,contest_id,tokens,occupations,topic
"Driver, the mini-bar needs to be refreshed.",1.1470588235294117,0.0747229337565888,34,30,3,1,driver the mini bar needs to be refreshed,70,"['driver', 'the', 'mini', 'bar', 'needs', 'to', 'be', 'refreshed']",{'driver'},0
I'll be the backseat driver next time,1.1290322580645162,0.0767895529950844,31,28,2,1,i will be the backseat driver next time,70,"['i', 'will', 'be', 'the', 'backseat', 'driver', 'next', 'time']",{'driver'},0
Front seat driver,1.103448275862069,0.0575533076135365,29,26,3,0,front seat driver,70,"['front', 'seat', 'driver']",{'driver'},0
We'll need to extend to 40 yards to get past this line of driver-less trucks.,1.0454545454545454,0.0465242105199235,22,21,1,0,we will need to extend to 40 yards to get past this line of driver less trucks,70,"['we', 'will', 'need', 'to', 'extend', 'to', '40', 'yards', 'to', 'get', 'past', 'this', 'line', 'of', 'driver', 'less', 'trucks']",{'driver'},0
"No Joe, I'm not a back seat driver! You just needed to turn right at the light like I told you!",1.0454545454545454,0.0465242105199235,22,21,1,0,no joe i am not a back seat driver you just needed to turn right at the light like i told you,70,"['no', 'joe', 'i', 'am', 'not', 'a', 'back', 'seat', 'driver', 'you', 'just', 'needed', 'to', 'turn', 'right', 'at', 'the', 'light', 'like', 'i', 'told', 'you']",{'driver'},0
This hasn't really resolved that backseat driver thing.,1.0,0.0606339062590832,17,17,0,0,this has not really resolved that backseat driver thing,70,"['this', 'has', 'not', 'really', 'resolved', 'that', 'backseat', 'driver', 'thing']",{'driver'},0
"I'm sorry, we no longer provide driver-less magic carpets. Uber has that market now.",1.1914893617021276,0.0722206114497014,47,40,5,2,i am sorry we no longer provide driver less magic carpets uber has that market now,73,"['i', 'am', 'sorry', 'we', 'no', 'longer', 'provide', 'driver', 'less', 'magic', 'carpets', 'uber', 'has', 'that', 'market', 'now']",{'driver'},-1
Wait 'til he finds out the pilots are squirrels.,1.3305785123966942,0.0516776800028544,121,87,28,6,wait til he finds out the pilots are squirrels,74,"['wait', 'til', 'he', 'finds', 'out', 'the', 'pilots', 'are', 'squirrels']",{'pilot'},0
This reminds me of the time Buster was barking at that mailman-shaped alien spacecraft.,1.2705882352941176,0.0612389252415392,85,67,13,5,this reminds me of the time buster was barking at that mailman shaped alien spacecraft,74,"['this', 'reminds', 'me', 'of', 'the', 'time', 'buster', 'was', 'barking', 'at', 'that', 'mailman', 'shaped', 'alien', 'spacecraft']",{'mailman'},1
She was right about vacuums - maybe we should investigate the mailman too.,1.2592592592592593,0.0576755981570275,81,63,15,3,she was right about vacuums maybe we should investigate the mailman too,74,"['she', 'was', 'right', 'about', 'vacuums', 'maybe', 'we', 'should', 'investigate', 'the', 'mailman', 'too']",{'mailman'},1
I thought he only barked at the mailman.,1.2153846153846153,0.055868611716669,65,52,12,1,i thought he only barked at the mailman,74,"['i', 'thought', 'he', 'only', 'barked', 'at', 'the', 'mailman']",{'mailman'},1
Sparky might be wrong about the mailman.,1.2153846153846153,0.0675544925778857,65,55,6,4,sparky might be wrong about the mailman,74,"['sparky', 'might', 'be', 'wrong', 'about', 'the', 'mailman']",{'mailman'},1
I thought he only barked at the mailman.,1.108108108108108,0.0517528166354777,37,33,4,0,i thought he only barked at the mailman,74,"['i', 'thought', 'he', 'only', 'barked', 'at', 'the', 'mailman']",{'mailman'},1
"Well, I assume the dog thinks the mailman is responsible for the cat-piloted vacuum ship.",1.088235294117647,0.0493748270390892,34,31,3,0,well i assume the dog thinks the mailman is responsible for the cat piloted vacuum ship,74,"['well', 'i', 'assume', 'the', 'dog', 'thinks', 'the', 'mailman', 'is', 'responsible', 'for', 'the', 'cat', 'piloted', 'vacuum', 'ship']",{'mailman'},1
These are from back when cars had drivers.,1.786099460754943,0.0185953860130703,1669,698,630,341,these are from back when cars had drivers,75,"['these', 'are', 'from', 'back', 'when', 'cars', 'had', 'drivers']",{'driver'},0
Try to see it from the driver’s perspective.,1.45985401459854,0.0420171316094795,274,180,62,32,try to see it from the driver ’ s perspective,75,"['try', 'to', 'see', 'it', 'from', 'the', 'driver', '’', 's', 'perspective']",{'driver'},0
this campaign was very successful until drivers figured out we don't really follow these signs,1.2285714285714286,0.0648981638044391,70,58,8,4,this campaign was very successful until drivers figured out we do not really follow these signs,75,"['this', 'campaign', 'was', 'very', 'successful', 'until', 'drivers', 'figured', 'out', 'we', 'do', 'not', 'really', 'follow', 'these', 'signs']",{'driver'},0
That was my wife and daughter before a texting driver took them away.,1.169811320754717,0.0645170123973668,53,46,5,2,that was my wife and daughter before a texting driver took them away,75,"['that', 'was', 'my', 'wife', 'and', 'daughter', 'before', 'a', 'texting', 'driver', 'took', 'them', 'away']",{'driver'},0
"You think it targets drivers with children?"" ""Don't say targets",1.169811320754717,0.0586238473980282,53,45,7,1,you think it targets drivers with children do not say targets,75,"['you', 'think', 'it', 'targets', 'drivers', 'with', 'children', 'do', 'not', 'say', 'targets']",{'driver'},0
They were illustrations showing drivers what to hit.,1.169811320754717,0.0586238473980282,53,45,7,1,they were illustrations showing drivers what to hit,75,"['they', 'were', 'illustrations', 'showing', 'drivers', 'what', 'to', 'hit']",{'driver'},0
"But do you see it as the driver, or as the car?",1.169811320754717,0.0699151935820582,53,47,3,3,but do you see it as the driver or as the car,75,"['but', 'do', 'you', 'see', 'it', 'as', 'the', 'driver', 'or', 'as', 'the', 'car']",{'driver'},0
Even that didn't help with distracted drivers.,1.156862745098039,0.0585615079336003,51,44,6,1,even that did not help with distracted drivers,75,"['even', 'that', 'did', 'not', 'help', 'with', 'distracted', 'drivers']",{'driver'},0
"If we slip out now, Steve will be the one that crosses the street when the driver think it's all clear.",1.127659574468085,0.0653533856102869,47,43,2,2,if we slip out now steve will be the one that crosses the street when the driver think it is all clear,75,"['if', 'we', 'slip', 'out', 'now', 'steve', 'will', 'be', 'the', 'one', 'that', 'crosses', 'the', 'street', 'when', 'the', 'driver', 'think', 'it', 'is', 'all', 'clear']",{'driver'},0
Do you think drivers ever notice these?,1.0975609756097562,0.0469155708821252,41,37,4,0,do you think drivers ever notice these,75,"['do', 'you', 'think', 'drivers', 'ever', 'notice', 'these']",{'driver'},0
Only an automobile driver would call this art.,1.0810810810810811,0.0597590052316288,37,35,1,1,only an automobile driver would call this art,75,"['only', 'an', 'automobile', 'driver', 'would', 'call', 'this', 'art']",{'driver'},0
"Yeah, you got to study the drivers' manual",1.0571428571428572,0.0398074597725277,35,33,2,0,yeah you got to study the drivers manual,75,"['yeah', 'you', 'got', 'to', 'study', 'the', 'drivers', 'manual']",{'driver'},0
Were these works of art designed to engage drivers to slow down or enrage them to speed up?,1.0571428571428572,0.0398074597725277,35,33,2,0,were these works of art designed to engage drivers to slow down or enrage them to speed up,75,"['were', 'these', 'works', 'of', 'art', 'designed', 'to', 'engage', 'drivers', 'to', 'slow', 'down', 'or', 'enrage', 'them', 'to', 'speed', 'up']",{'driver'},0
We are so blessed most drivers find us too tough to chew.,1.0571428571428572,0.0398074597725277,35,33,2,0,we are so blessed most drivers find us too tough to chew,75,"['we', 'are', 'so', 'blessed', 'most', 'drivers', 'find', 'us', 'too', 'tough', 'to', 'chew']",{'driver'},0
Caution to drivers or enticement for hunters? So subjective.,1.03125,0.0317500317500476,32,31,1,0,caution to drivers or enticement for hunters so subjective,75,"['caution', 'to', 'drivers', 'or', 'enticement', 'for', 'hunters', 'so', 'subjective']","{'driver', 'hunter'}",0
I was shocked when he took this one from Rte. 28. Drivers are not slowing down for that fake Van Gogh he put up. cheap Van Gogh Cheap,1.0277777777777777,0.0281718084909505,36,35,1,0,i was shocked when he took this one from rte 28 drivers are not slowing down for that fake van gogh he put up cheap van gogh cheap,75,"['i', 'was', 'shocked', 'when', 'he', 'took', 'this', 'one', 'from', 'rte', '28', 'drivers', 'are', 'not', 'slowing', 'down', 'for', 'that', 'fake', 'van', 'gogh', 'he', 'put', 'up', 'cheap', 'van', 'gogh', 'cheap']",{'driver'},0
"Don't get me wrong, they are fantastic military drone pilots, but they seem too focused on bombing cars.",1.0,0.0377425678048198,27,27,0,0,do not get me wrong they are fantastic military drone pilots but they seem too focused on bombing cars,80,"['do', 'not', 'get', 'me', 'wrong', 'they', 'are', 'fantastic', 'military', 'drone', 'pilots', 'but', 'they', 'seem', 'too', 'focused', 'on', 'bombing', 'cars']","{'pilot', 'military'}",0
"Hello GOP. Yes, I just got your Republican tax break bill notice from the mailman...interesting delivery method you picked for us in the middle class, good joke, point well made.",1.3414634146341464,0.0698850783643773,82,61,14,7,hello gop yes i just got your republican tax break bill notice from the mailman interesting delivery method you picked for us in the middle class good joke point well made,81,"['hello', 'gop', 'yes', 'i', 'just', 'got', 'your', 'republican', 'tax', 'break', 'bill', 'notice', 'from', 'the', 'mailman', 'interesting', 'delivery', 'method', 'you', 'picked', 'for', 'us', 'in', 'the', 'middle', 'class', 'good', 'joke', 'point', 'well', 'made']",{'mailman'},1
You forgot to tip the mailman.,1.324675324675325,0.0652079025440129,77,56,17,4,you forgot to tip the mailman,81,"['you', 'forgot', 'to', 'tip', 'the', 'mailman']",{'mailman'},1
"'I'm sorry but I have to cancel the movers, Iv'e been stuck with my old rental agreement for another year.""",1.3043478260869563,0.0694158669593257,69,52,13,4,i am sorry but i have to cancel the movers iv e been stuck with my old rental agreement for another year,81,"['i', 'am', 'sorry', 'but', 'i', 'have', 'to', 'cancel', 'the', 'movers', 'iv', 'e', 'been', 'stuck', 'with', 'my', 'old', 'rental', 'agreement', 'for', 'another', 'year']",{'mover'},-1
The mailman was really eager to give me the news,1.1,0.0557086014531155,30,27,3,0,the mailman was really eager to give me the news,81,"['the', 'mailman', 'was', 'really', 'eager', 'to', 'give', 'me', 'the', 'news']",{'mailman'},1
I wish you could rate process servers like you do Uber drivers.,1.0,0.0444554224474387,23,23,0,0,i wish you could rate process servers like you do uber drivers,81,"['i', 'wish', 'you', 'could', 'rate', 'process', 'servers', 'like', 'you', 'do', 'uber', 'drivers']","{'driver', 'server'}",-1
I think I'll pass. I'm your designated driver.,1.5495495495495497,0.031204366942818,555,331,143,81,i think i will pass i am your designated driver,84,"['i', 'think', 'i', 'will', 'pass', 'i', 'am', 'your', 'designated', 'driver']",{'driver'},0
"None for me, thanks. I'm your designated driver.",1.517073170731707,0.0369042102411828,410,261,86,63,none for me thanks i am your designated driver,84,"['none', 'for', 'me', 'thanks', 'i', 'am', 'your', 'designated', 'driver']",{'driver'},0
"Sorry, I can't. I'm your designated driver.",1.413978494623656,0.046724646149568,186,124,47,15,sorry i can not i am your designated driver,84,"['sorry', 'i', 'can', 'not', 'i', 'am', 'your', 'designated', 'driver']",{'driver'},0
"No thanks, I'm your designated driver tonight.",1.391304347826087,0.0522579550866207,161,114,31,16,no thanks i am your designated driver tonight,84,"['no', 'thanks', 'i', 'am', 'your', 'designated', 'driver', 'tonight']",{'driver'},0
"No thanks, I'm your Designated Driver.",1.3767123287671232,0.0542396325412091,146,105,27,14,no thanks i am your designated driver,84,"['no', 'thanks', 'i', 'am', 'your', 'designated', 'driver']",{'driver'},0
Can't. I'm your designated driver.,1.3587786259541983,0.0553308548509867,131,95,25,11,can not i am your designated driver,84,"['can', 'not', 'i', 'am', 'your', 'designated', 'driver']",{'driver'},0
I'm his designated driver.,1.352,0.0523708857803584,125,88,30,7,i am his designated driver,84,"['i', 'am', 'his', 'designated', 'driver']",{'driver'},-1
"No, thank you. I'm your designated driver tonight.",1.3303571428571428,0.0586588539076071,112,84,19,9,no thank you i am your designated driver tonight,84,"['no', 'thank', 'you', 'i', 'am', 'your', 'designated', 'driver', 'tonight']",{'driver'},0
"No thanks pal, I'm your designated driver",1.3240740740740742,0.0614646204573438,108,83,15,10,no thanks pal i am your designated driver,84,"['no', 'thanks', 'pal', 'i', 'am', 'your', 'designated', 'driver']",{'driver'},0
"No thanks, I’m the designated driver this evening.",1.2934782608695652,0.0628553794728941,92,72,13,7,no thanks i am the designated driver this evening,84,"['no', 'thanks', 'i', 'am', 'the', 'designated', 'driver', 'this', 'evening']",{'driver'},0
Are you my designated driver?,1.2934782608695652,0.0628553794728941,92,72,13,7,are you my designated driver,84,"['are', 'you', 'my', 'designated', 'driver']",{'driver'},0
"No, thanks, but I can be your designated driver.",1.2790697674418603,0.0611140594307791,86,67,14,5,no thanks but i can be your designated driver,84,"['no', 'thanks', 'but', 'i', 'can', 'be', 'your', 'designated', 'driver']",{'driver'},0
"Thanks, but no thanks. I am your designated driver tonight, you know.",1.2738095238095235,0.0684874501701313,84,69,7,8,thanks but no thanks i am your designated driver tonight you know,84,"['thanks', 'but', 'no', 'thanks', 'i', 'am', 'your', 'designated', 'driver', 'tonight', 'you', 'know']",{'driver'},0
"No thanks, I'm your Designated Driver.",1.2658227848101269,0.0642254952139213,79,63,11,5,no thanks i am your designated driver,84,"['no', 'thanks', 'i', 'am', 'your', 'designated', 'driver']",{'driver'},0
I can’t. I’m your designated driver.,1.2533333333333334,0.0603095119963446,75,59,13,3,i can not i am your designated driver,84,"['i', 'can', 'not', 'i', 'am', 'your', 'designated', 'driver']",{'driver'},0
"No thank you, I'm going to be your designated driver, tonight!",1.2533333333333334,0.0660148313484019,75,61,9,5,no thank you i am going to be your designated driver tonight,84,"['no', 'thank', 'you', 'i', 'am', 'going', 'to', 'be', 'your', 'designated', 'driver', 'tonight']",{'driver'},0
"Thanks, but no. I'm the designated driver.",1.24,0.0595478458547909,75,60,12,3,thanks but no i am the designated driver,84,"['thanks', 'but', 'no', 'i', 'am', 'the', 'designated', 'driver']",{'driver'},0
"No thanks, I'm sorta your designated driver.",1.2352941176470589,0.0596950365770309,68,54,12,2,no thanks i am sorta your designated driver,84,"['no', 'thanks', 'i', 'am', 'sorta', 'your', 'designated', 'driver']",{'driver'},0
I can't. I'm your designated driver. Not that you'll survive the ride home either way but it's the principle of the thing.,1.2272727272727273,0.0675769596514698,66,55,7,4,i can not i am your designated driver not that you will survive the ride home either way but it is the principle of the thing,84,"['i', 'can', 'not', 'i', 'am', 'your', 'designated', 'driver', 'not', 'that', 'you', 'will', 'survive', 'the', 'ride', 'home', 'either', 'way', 'but', 'it', 'is', 'the', 'principle', 'of', 'the', 'thing']",{'driver'},0
Drink up! I'm your designated driver.,1.2272727272727273,0.0675769596514698,66,55,7,4,drink up i am your designated driver,84,"['drink', 'up', 'i', 'am', 'your', 'designated', 'driver']",{'driver'},0
No thanks. I'm tonight's designated driver.,1.2272727272727273,0.0602846957638126,66,53,11,2,no thanks i am tonight s designated driver,84,"['no', 'thanks', 'i', 'am', 'tonight', 's', 'designated', 'driver']",{'driver'},0
"Thanks for the beer, stranger! No, I don't have a designated driver. Why do you ask?",1.2096774193548387,0.0655977549490785,62,52,7,3,thanks for the beer stranger no i do not have a designated driver why do you ask,84,"['thanks', 'for', 'the', 'beer', 'stranger', 'no', 'i', 'do', 'not', 'have', 'a', 'designated', 'driver', 'why', 'do', 'you', 'ask']",{'driver'},0
"I will be your designated driver, no problem.",1.2096774193548387,0.0695117701122045,62,53,5,4,i will be your designated driver no problem,84,"['i', 'will', 'be', 'your', 'designated', 'driver', 'no', 'problem']",{'driver'},0
"No thanks, I'm your designated driver tonight.",1.2096774193548387,0.0614348819856175,62,51,9,2,no thanks i am your designated driver tonight,84,"['no', 'thanks', 'i', 'am', 'your', 'designated', 'driver', 'tonight']",{'driver'},0
"C’mon, its not like we’re going to need a designated driver.",1.2033898305084745,0.0674303373104479,59,50,6,3,c ’ mon its not like we are going to need a designated driver,84,"['c', '’', 'mon', 'its', 'not', 'like', 'we', 'are', 'going', 'to', 'need', 'a', 'designated', 'driver']",{'driver'},0
Why don’t I just be the designated driver?,1.2033898305084745,0.0716331203127763,59,51,4,4,why do not i just be the designated driver,84,"['why', 'do', 'not', 'i', 'just', 'be', 'the', 'designated', 'driver']",{'driver'},0
"Sorry, I'm the designated driver tonight.",1.1929824561403508,0.0583750110218151,57,47,9,1,sorry i am the designated driver tonight,84,"['sorry', 'i', 'am', 'the', 'designated', 'driver', 'tonight']",{'driver'},0
"No thanks pal, I'm your designated driver",1.181818181818182,0.0585510171563209,55,46,8,1,no thanks pal i am your designated driver,84,"['no', 'thanks', 'pal', 'i', 'am', 'your', 'designated', 'driver']",{'driver'},0
I'll be your designated driver tonight...enjoy!,1.181818181818182,0.0585510171563209,55,46,8,1,i will be your designated driver tonight enjoy,84,"['i', 'will', 'be', 'your', 'designated', 'driver', 'tonight', 'enjoy']",{'driver'},0
"Hey, how 'bout one for the road... or are you my designated driver?",1.1730769230769231,0.0596694884155894,52,44,7,1,hey how bout one for the road or are you my designated driver,84,"['hey', 'how', 'bout', 'one', 'for', 'the', 'road', 'or', 'are', 'you', 'my', 'designated', 'driver']",{'driver'},0
"I would love to join you, but I'm also an Uber driver on the side.",1.1730769230769231,0.0656855818330743,52,45,5,2,i would love to join you but i am also an uber driver on the side,84,"['i', 'would', 'love', 'to', 'join', 'you', 'but', 'i', 'am', 'also', 'an', 'uber', 'driver', 'on', 'the', 'side']",{'driver'},0
No thanks. I'm the designated driver tonight.,1.16,0.0661476394445155,50,44,4,2,no thanks i am the designated driver tonight,84,"['no', 'thanks', 'i', 'am', 'the', 'designated', 'driver', 'tonight']",{'driver'},0
I'm his designated driver.,1.16,0.0720544012166771,50,45,2,3,i am his designated driver,84,"['i', 'am', 'his', 'designated', 'driver']",{'driver'},-1
I’m your designated driver!,1.16,0.0661476394445155,50,44,4,2,i am your designated driver,84,"['i', 'am', 'your', 'designated', 'driver']",{'driver'},0
Are you my Uber driver,1.16,0.0661476394445155,50,44,4,2,are you my uber driver,84,"['are', 'you', 'my', 'uber', 'driver']",{'driver'},0
"No thanks, I'm a designated driver.",1.16,0.0596588943366317,50,43,6,1,no thanks i am a designated driver,84,"['no', 'thanks', 'i', 'am', 'a', 'designated', 'driver']",{'driver'},0
"No thanks, I'm a designated driver.",1.156862745098039,0.0585615079336003,51,44,6,1,no thanks i am a designated driver,84,"['no', 'thanks', 'i', 'am', 'a', 'designated', 'driver']",{'driver'},0
Sorry but I am the designated driver for tonight,1.148936170212766,0.0606679090918393,47,41,5,1,sorry but i am the designated driver for tonight,84,"['sorry', 'but', 'i', 'am', 'the', 'designated', 'driver', 'for', 'tonight']",{'driver'},0
Charon is your designated driver?,1.148936170212766,0.0524931025314009,47,40,7,0,charon is your designated driver,84,"['charon', 'is', 'your', 'designated', 'driver']",{'driver'},0
You the designated driver??,1.1333333333333333,0.0681649810860726,45,41,2,2,you the designated driver,84,"['you', 'the', 'designated', 'driver']",{'driver'},0
Just one. I am your designated driver.,1.1333333333333333,0.0512470743190538,45,39,6,0,just one i am your designated driver,84,"['just', 'one', 'i', 'am', 'your', 'designated', 'driver']",{'driver'},0
"""No thanks.... remember, you're my designated driver""!",1.1333333333333333,0.0603022689155527,45,40,4,1,no thanks remember you are my designated driver,84,"['no', 'thanks', 'remember', 'you', 'are', 'my', 'designated', 'driver']",{'driver'},0
"No, thanks. I am going to be your designated driver this evening.",1.1333333333333333,0.0681649810860726,45,41,2,2,no thanks i am going to be your designated driver this evening,84,"['no', 'thanks', 'i', 'am', 'going', 'to', 'be', 'your', 'designated', 'driver', 'this', 'evening']",{'driver'},0
No thanks. I'm the designated driver tonight.,1.1333333333333333,0.0603022689155527,45,40,4,1,no thanks i am the designated driver tonight,84,"['no', 'thanks', 'i', 'am', 'the', 'designated', 'driver', 'tonight']",{'driver'},0
Thanks but I've got one more drunk driver to care off and then I'm off the clock.,1.1333333333333333,0.0603022689155527,45,40,4,1,thanks but i have got one more drunk driver to care off and then i am off the clock,84,"['thanks', 'but', 'i', 'have', 'got', 'one', 'more', 'drunk', 'driver', 'to', 'care', 'off', 'and', 'then', 'i', 'am', 'off', 'the', 'clock']",{'driver'},0
"No thanks, I'm your Designated Driver. Feel free to have one for the road, though....",1.1304347826086956,0.0590479674998938,46,41,4,1,no thanks i am your designated driver feel free to have one for the road though,84,"['no', 'thanks', 'i', 'am', 'your', 'designated', 'driver', 'feel', 'free', 'to', 'have', 'one', 'for', 'the', 'road', 'though']",{'driver'},0
"Thanks, but no thanks, I'm the designated driver tonight.",1.1025641025641026,0.0492161471762765,39,35,4,0,thanks but no thanks i am the designated driver tonight,84,"['thanks', 'but', 'no', 'thanks', 'i', 'am', 'the', 'designated', 'driver', 'tonight']",{'driver'},0
"Trust me, no one is going to pick you for their designated driver.",1.1025641025641026,0.0492161471762765,39,35,4,0,trust me no one is going to pick you for their designated driver,84,"['trust', 'me', 'no', 'one', 'is', 'going', 'to', 'pick', 'you', 'for', 'their', 'designated', 'driver']",{'driver'},0
"Thanks, but I'm the designated driver tonight. Need a ride?",1.1025641025641026,0.0492161471762765,39,35,4,0,thanks but i am the designated driver tonight need a ride,84,"['thanks', 'but', 'i', 'am', 'the', 'designated', 'driver', 'tonight', 'need', 'a', 'ride']",{'driver'},0
Of coursh I'd be happy to be your deshigg... deshignated driver.,1.1025641025641026,0.0614146302455209,39,36,2,1,of coursh i would be happy to be your deshigg deshignated driver,84,"['of', 'coursh', 'i', 'would', 'be', 'happy', 'to', 'be', 'your', 'deshigg', 'deshignated', 'driver']",{'driver'},0
"Shall the Devil, then, be the designated driver?",1.1025641025641026,0.0492161471762765,39,35,4,0,shall the devil then be the designated driver,84,"['shall', 'the', 'devil', 'then', 'be', 'the', 'designated', 'driver']",{'driver'},0
"I know I’m your designated driver, but just let me finish this last one.",1.1025641025641026,0.0614146302455209,39,36,2,1,i know i am your designated driver but just let me finish this last one,84,"['i', 'know', 'i', 'am', 'your', 'designated', 'driver', 'but', 'just', 'let', 'me', 'finish', 'this', 'last', 'one']",{'driver'},0
Let’s find a designated driver and tie one on!,1.1,0.0480384461415261,40,36,4,0,let us find a designated driver and tie one on,84,"['let', 'us', 'find', 'a', 'designated', 'driver', 'and', 'tie', 'one', 'on']",{'driver'},0
Me? I'm your designated driver.,1.1,0.0599144689515278,40,37,2,1,me i am your designated driver,84,"['me', 'i', 'am', 'your', 'designated', 'driver']",{'driver'},0
YOU MUST BE MY UBER DRIVER. HAVE ONE ON ME,1.0975609756097562,0.0469155708821252,41,37,4,0,you must be my uber driver have one on me,84,"['you', 'must', 'be', 'my', 'uber', 'driver', 'have', 'one', 'on', 'me']",{'driver'},0
"As your designated driver, I'll have to take a pass.",1.0810810810810811,0.0454932654881174,37,34,3,0,as your designated driver i will have to take a pass,84,"['as', 'your', 'designated', 'driver', 'i', 'will', 'have', 'to', 'take', 'a', 'pass']",{'driver'},0
"No thanks, I'm working. I'm an Uber driver, on break.",1.0606060606060606,0.0421800330517425,33,31,2,0,no thanks i am working i am an uber driver on break,84,"['no', 'thanks', 'i', 'am', 'working', 'i', 'am', 'an', 'uber', 'driver', 'on', 'break']",{'driver'},0
"Sorry pal, as your designated driver I can't.",1.0606060606060606,0.0421800330517425,33,31,2,0,sorry pal as your designated driver i can not,84,"['sorry', 'pal', 'as', 'your', 'designated', 'driver', 'i', 'can', 'not']",{'driver'},0
It’s not like you’re their designated driver...,1.0333333333333334,0.0339031751810405,30,29,1,0,it is not like you are their designated driver,84,"['it', 'is', 'not', 'like', 'you', 'are', 'their', 'designated', 'driver']",{'driver'},0
"I shouldn't, I'm your designated driver.",1.0333333333333334,0.0339031751810405,30,29,1,0,i should not i am your designated driver,84,"['i', 'should', 'not', 'i', 'am', 'your', 'designated', 'driver']",{'driver'},0
"No thanks, I'm killing the designated driver tonight.",1.0333333333333334,0.0339031751810405,30,29,1,0,no thanks i am killing the designated driver tonight,84,"['no', 'thanks', 'i', 'am', 'killing', 'the', 'designated', 'driver', 'tonight']",{'driver'},0
