caption,topic
"you think you'd be smarter, you spend so much time in our schools",-1
I win! You're alive!,1
Now who’s in trouble?,87
The Squid game is on… Again!,4
"En passant! It's a legitimate capture. Read the rules, sucker!",75
Checkmate!  You owe me twenty years!,35
Checkmate Cancer!  The immuno-revolution and a path to victory...after 50 years of the War on Cancer.,17
Checkmate! That look on your face is to die for.,11
Checkmate!  And I advance to the finals in Samarra.,85
"I resign but tomorrow you play on the other side.""",-1
Ha! Now bring Calvin Coolidge back to life.,74
I lose again... The Queen's Gambit really ruined this gig.,24
You may have won this time but I should remind you that our student loans die with you.,-1
Now do I get to see Bibi Anderson?,-1
"I warned you, I would kill you at this: Checkmate.",-1
You mean we’re not playing tiddlywinks?,4
35 years and you still fall for it!,35
"Check mate, Old Scratch.  Your soul is mime.",41
"That’s how you close Grim’s Gambit, you sickle selling reapist. Now, go get your ferry. We are leaving.",-1
"Ok, now let's go...",18
"Come on, now, ‘two out of three’ wasn’t our deal.",23
Death's chess game never really recovered after his loss to Deep Blue.,2
"I guess you should have stayed in your lane, eh?",-1
Once again Gary had cheated death.,0
"Checkmate! Curtains! Hasta la vista, baby!",14
I WIN! A bet is a bet...give me your scythe,30
"Hey, you released it delivering my fatal blow; sorry for your loss.",-1
Got ya! And I didn't cheat!,0
"I work on Wall Street - I can cheat you, too.",0
Aha! Looks like I’ll be eating red meat again after all.,47
That’s my daily multivitamin in your FACE!!”  (forgot the hashtag the first time I posted,-1
"Uncheck me, mate.",3
"Tommy, it's your turn to move the pawn!""
""Check mate!!",48
I’m feeling great. Why do you ask?,-1
Who's got the upper hand now?,87
This isn’t Ingmar Bergman!,16
Check!  So this time we're going to a disco!,-1
That’s checkmate and 20 more years to my lifespan.,35
reconsider?,-1
"You can't cheat death, but you can have a killer endgame!",0
"Ha! More like the ‘Fail Horseman’. Checkmate, you lose. As per our agreement, the vacuum is in the closet, get started.",31
Mate is just a term,3
My name is Benjamin Button!,-1
Checkmate! I got your soul...,41
"Before I utter the obvious, a question.
Should I?",-1
Mate! This is what I think of your Mate. Now come dance with me over the hills.,3
Read my jaw bone! Are you sure you want to play that move?!,25
Good thing we're playing chess and not strip poker.,2
"And that is 1,000 wins for me.  See you next year.",1
Don't kill me for this one. Checkmate!,15
Now can I come with you?,32
"Checkmate in 11 moves, ha! Now I want my soul back.",41
I said  check “mate” not hate!,3
"Dude, did you not watch ""The Queen's Gambit""?",24
"Remember, when you play the Sicilian Defense and lose you sleep with the dishes.",73
"No, I would not rather play checkers.",56
"Well sure, but I just saved 15% on my life insurance by switching to #ad",70
"Checkmate! OK Charon! ,  you owe me that round trip 
 riverboat ride you been bragging about!""",-1
Joke's on you. You're still going to die.,53
"I win, now I get to fuck you in the ass, Mr. Death!",1
"Idiot.  Now get to work.  I'm V. Potin, not V. Putin.",65
"Oh Steve, and yet, I still win",0
"Now, take off the cloak.",14
Why do they call it oven when you of in the cold food and of hot out eat the food?,32
Is it really smart to checkmate death? I can checkmate you right now?,11
So now you’ll talk to the IRS for me?,5
Don’t be so grim. It’s not the end of the world…right?,29
I think I beat you...don't be mad...can we negotiate a deal like Dr. Fausto's?,63
Did you think I'd actually let you off if you beat me?,34
"I’d finish my move, but my arm just went numb",-1
Tell me again why you insisted on playing Speed Chess?,2
Never mind that two out of three crap!,13
You'e been Windmilled Dutch.,49
"Beckon me?  You Silly Sonnavabitch,drop the hollow shroud. It",14
Full disclosure. I’m a cyborg.,-1
"No, I've never seen that Bergman movie ...",16
And you thought you could sucker me into dicing with you!,-1
"Not today, old friend!",42
"Thanks, roomie—you’re takin’ out the trash!",-1
"Eternal life, and you have to get me a reduction in health insurance!",70
Checkmate! Why don't you help that king of yours pass on?,80
"Sir, are you familiar with that ancient Chinese curse . .  .?",-1
Screw Ingmar Bergman...CHECKMATE!,16
"I'm not playing, just helping the good guys.",4
It's your move. I don't have all day.,-1
How can you have the last laugh if I just put your king in checkmate?,80
...And that's what I call a killer move!,8
"You said that this was going to be a friendly game, but I take it you're not too thrilled that I checkmated you.",-1
"That's it! I've just won three games in a row!  Now you have to honor your bet and allow me to live to age 150, never get sick in this current lif, and, for my next incarnation, I'll get born as a handsome, healthy, athletic, popular, successful guy!",-1
The bet was about chess not my chest!,2
"Don’t you understand? You can’t win.”
Erica Weingast, New York, N",1
Checkmate......hey gotta run.,15
Order of the Phoenix,13
You millennials are so easy…..,-1
How ‘bout I take your rook instead ok taking a look.,78
Checkmate!  Now remove one article of clothing.,14
"Checkmate! Rules are rules, you have to take me now!",-1
You play like a mere mortal,4
Any time.,18
Love vax-free chess!,2
I've lured you into a devious trap.,-1
"KING beats DEATH!
That’s Final!",7
You can't be afraid to make sacrifices!,77
Looks like I get your horsey piece,62
"Checkmate, Death. I have bested you and won our wager. Now, cough up the $5!",5
It kills me that I made you feel foolish.,-1
I'm actually trying to lose.,1
Checkmate again! That’s the same way I’ve beaten you the past 27 games.  I’m beginning to think you’re losing on purpose.,31
"Read my lips.
You don't have lips.",43
"Wow, you’re a quick learner…",4
That’s my metacarpal not checkmate,9
"Yes, you won, but remember the deal of the eye contact? Well... Or should I already say Hell?",1
So you’re giving me the finger because even though it’s checkmate I still lose?,12
"google en passant"" ""holy hell",75
Sit back down. Angel of Death beats your Queen.,6
"OK, checkmate! Now you have to visit my boss.",-1
Let me show you… just castle the 14th Amendment,66
Check Mate”…..poof!!!,3
I pronounce the name of Jesus BISHOP save me!,28
"Just come on back if you ever wanna try again.
I done told you once, I'm the best that's ever been.",-1
Mere mortals are all the same. Come hither.,-1
"As agreed, you now have to bring Fluffy back to life.  Care to play again ... this time for the Equal Rights Amendment?",58
"Check mate , baby !!",3
Aha! And now you owe me a copy of Blades of Glory on DVD!,49
"It is called the Ukraine defense, Mr. Putin.""",88
I didn’t cheat you. I played white!,0
And I can kick your ass at checkers too!,56
"Just kidding! Check mate or not, you're coming to me.",3
I don't think you're getting the meaning of our littler interaction so let me introduce you to my captured King - Pyrrhus,7
Checkmate! Now go to Hell!,82
What makes you so sure I won't win again?,1
"I don't care if it's 'checkmate,', you just can't cheat Death.",-1
Dogging COVID-19 for 2 years takes risk and strategy,17
Tonight I’m on top!,-1
"Gotcha, you greedy bastard!!",57
Checkmate. I thought you had a better move up your sleeves.,38
"You're not only living dead, but playing dead!",53
"*sigh* “Jim; you say ‘Checkmate,’ not ‘touchdown’.”",9
I win! Give me the AXE!,1
My game!  Time to honor the bet.  I believe you’ll find Putin at his palace in Gelendzhik.,65
You'd've done better if your pieces didn't die every time you touched them.,-1
Ha! Whose funeral is it now?,-1
I gotcha. Checkmate! Now I get to keep my soul.,41
Your Death Wall Gambit didn’t work. Checkmate!,-1
"Wait,who wins?",1
Next time we play speed chess.,2
Read 'em and reap!,61
POV: you were born after 1985 and just lived through another near-miss apocalypse.,-1
You got no answer for this! Right??,-1
You have to wonder why people insist on playing games.,4
"No, Mate, I'm an Aussie. I said I'd pick up the check.",3
I can’t go now. Two out of three?,23
"You took my king with Be1,but now my friend U2r done.",7
Roe v. Wade: checkmate.,58
Reigning Russian Master losses to young Ukrainian Actor,-1
"The Seventh Seal? That's not one of those TikTok dance challenges, is it?",22
You can't cheat death buddy.,0
I thought we were playing checkers,56
Perhaps you should check YOUR mate.,3
I should have stuck with the fiddle contest.,44
You can take my queen but you can’t take me!,6
"If I were you, patience would be my joy.",4
I lose! Kill me!,-1
"Oh no, you cheat! That's not your dark horse - it's my white knight!",0
"You've lost your touch, old man!",12
I can see you're not a fan of Bergman. Wordle? Texas Hold'em?,16
"We all said, you can't cheat death",0
I guess you've never seen The Seventh Seal,22
"Oh come on, how did you do that!?",-1
"Fool’s mate! Sucker! Now who’s the new king of life and death? Waldo Grey, that’s who! Yes! Suck it! Where’s you’re big bad scythe now? Huh? Huh? Not so tough now, are you?",-1
Fingers lookin like e.t. with yo goofy ass boy dressed all emo and shit how u be typin w those corn dogs,12
Checkmate! Now here's whom I want you to visit.,39
"You brought a scythe to a gunfight, my friend.",30
Shipoopi!,52
"You are trying to cheat, again.",0
"That’s 3 in a row, so now I get your cloak.",14
Checkmate!   See you in 100 years!,35
"LISTEN,Mate, 
Would u like me to make a print for your mother?",79
My job can't suck the life out of me any more because I quit. Ha!,-1
"You are Roe V. Wade? Sorry, your prior win doesn't count.",58
If only you knew...,-1
Hah! And you thought you were invincible!,-1
I quit! Let’s play Monopoly!,-1
"Enough with the trying to cheat death line, checkmate!",-1
"unafraid, A check in the face of death",11
"So we're going to forget about that last bungee jump, right?",-1
"You may have killed Alekhine, but his defense still works.",73
Let's make a deal!,63
Do you really think you can beat Death without any consequences...,21
Naturally you must expect me to attack with Capo Ferro.,73
You gotta admit that was a killer move.,8
"You know, Moloch, I have a sneaking sense that someone is leaking info on all my best moves.",8
"CHECK!""   ""check MATE",3
Using a wipe is still considering touching a piece!  I'll take your queen!,6
"So what if you lost, dont look so grim, it’s not like it’s a matter of life or death!",29
Let me give you a piece of advice. Think of the black king as if it were you!,7
NOW will you let us impeach him?,-1
It's NOT that easy.,5
Checkmate!?! No you’re still dead,11
"It's called, ""en passant"", motherfucker!",75
How I feel taking a bite of my mother-in-law's cooking.,79
Looks like I'm going to beat Death this time.,21
Here ‘s your king. I thought you could use some help running the underworld,7
That’s checkmate and your doom,9
I'm living my best life and unfortunately this is it.,4
"Sure, I'd make a bet with cryptocurrency. It's safe, right?",91
Checkmate and check your orbital sockets!,-1
This is my last game.  I'm sick of the postmortems.,37
Checkmate! I get another fifty years.,35
This could well be your last move.,19
Ha! I've seen every film Bergman ever made!,16
Two out of three now; in the Ingmar Bergman movie there was only one game!,16
"That was fun, but I still don’t understand why we had to cancel the fiddle contest.",44
I resign.,-1
What do you mean I cheated?,0
"Remember, you are but a pawn in my deathly plan",48
Checkmate!  Maybe you should go try something else you're better at.,15
"Checkmate !! ....no, death mate",11
Oh yes I can cheat Death!,0
Let''s revisit this. How will I explain losing?,1
Check yourself. Before you wreck yourself.,3
I suppose only taxes are certain.,5
"Checkmate!   So as agreed, you go get my neighbor's dog, right?",-1
Aha! I beat ya!,-1
"Come closer and let me show you 
a real checkmate.",9
"Ah-ha! Checkmate! Fell for the oldest trick in the book didn't you. . . the old Fool's Mate. Ha-ha-ha! No sir, you'll never outwit me as long as I'm alive, friend. Ha-ha-ha! Want to try again?",-1
"Uh, I have to tell you, John, I don't have a soul for you to take, so how 'bout it'll be my turn for lunch on Thursday?",50
"Check-mate, Jane Roe, said the white male who is nothing but a douchebag.",-1
Ha! You shouldda been white! And male! And American!,27
Bobby Fisher has been looking forward to meeting you.,68
I didn’t think the NFT spiel would work on you.,-1
JENGA!,52
Killed your king!,7
That’s wizard’s chess,2
It's true.  You do cry when you lose your queen.,6
A5 B6 QG7 and that is mate. Do I get to live now.,-1
You have no mask.  You’re just a pawn.,-1
Let's call it The Immortal Game!,60
Yummy.,47
Is this the best you can do? No wonder Hitler had to kill himself.,21
"You play very well, young man, which annoys me, which is a terrible mistake on your part, and, anyway, you never had a chance, since, paralogically, you have to lose.",4
"Don't be mad, but checkmate!",15
Try that you silly old fool!,3
That’s four lives for me! Double or nothing again?,46
That's 3 jumps - king me!,7
You can't kill what it's already dead,21
"Take that,Putin",65
You didnt think it was Check Mate the moment I sat down?,3
"Psst, I do have one more move!",25
"Your attack is alright, but your defense is bare bones.",73
"So, young man, you won, now here is your prize.",1
"It’s simple.  I take a man, then you take a man.",-1
"You touched your queen, she has gotta die now",6
Checkmate good game sorry I gotta run no time to shake hands!,-1
It's called the push alert strategy! My queen stays here until your king becomes available!,6
Check Mate big guy! Or should I say Scythe-onara?,30
"I wouldn't have gone for ""mate,"" but ... your come hither glance...",3
Guess Death Got Played in 2022 & chess.,2
"You do realize who I am, right?",69
"Hah, you accepted my tax-evading gambit, checkmate!",5
Death never noticed how Dale cheated...,0
At least have the decency to look me in the cowl while you mate me...,3
I'm up for another rematch but no one has died in three days.,59
That was a bone-headed move: checkmate!,38
You're not being very sportsmanlike,-1
B4? There is no B4! There is only after. For all eternity!,60
That's my line.,-1
So now I can own a Monstera?,-1
ha! You're out of moves so now what are you going to do ?,-1
Checkmate! I beat Dea-th! I beat Dea-th! Ha Ha Ha Ha Ha! I beat Dea-th! I beat Dea-th! Take that Grim Reaper! I am kind of the world and you can't touch me!,-1
"Checkmate mofo!
Smoke THAT!",-1
The deal was one game then you remove the piece of stuck bread from my toaster using my scythe.,30
Eat my dust!,47
Check mate you say?  Let me show you what check mate really means.,3
Aha! You fell for the Bergman opening!,16
I think you’re ready to invest in crypto.,91
"Checkmate, I told you I was going to live forever. So you are not invincible after all!!",-1
"Remember Ralph,he who reaps wins.",90
"I know this is an illegal move, but for a moment I wanted to experience the illusion of victory before you take me to the Underworld.",-1
Chess wasn’t a good choice to sacrifice your queen,2
Congratulations!  You've just become the Soul Survivor.,50
James thought he would teach the guy in the funny outfit not to crash his Washington Square game.,0
Black Knight... is that really a wise choice?,33
I'm really looking for someone with more expertise in chess.,2
Ha!  Wait till I tell my squire!,33
Stalemate! Now I can cross ‘Deadlocking Death’ off my bucket list.”,-1
"Checkmate, dude! Oh man, how could you not see that coming? What a dummy. A child could defend that better. I can't believe you fell for it. You ever played this before? I'll send you some books. Chess for Dummies! Yeah, that's you! Ha Ha",2
I told you I had killer moves!,8
Let the game begin.,10
"Don’t get too cocky, I’ll be back again next week.",-1
"Ha ha, I win! You were already out of time when you agreed to play.",4
I see your variant and add a booster!,17
"I´m telling you man, I owe it all to crossfit.",0
"Our word for it is ""Checkmate.""",9
"Check mate, death - you can’t castle after you previously moved the King!",7
Told you I'd win! Now you HAVE to take my wife.,-1
Of course it’s an illegal move. Do sue me!,-1
I made it to the other side!,-1
"Come on, let me cheat ya, just one last time",0
"You did say, ‘best two-out-of-three’ – right?",13
I knew I’d make you Scream!,-1
"Mate or no-mate, you still lose.",1
The Longest Inch,-1
You're tapping and I'm swiping.,12
"Now, come with me and let’s see if you can hold onto that…uh…cheery disposition…",-1
But what happens to the king after he dies?,7
#39. Ra1? Exactly how Korchnoi lost to Karpov in 1978. I thought you said you were all knowing?,-1
"CHECK BUT YOU ARE NOT MY MATE, AUSSIE",3
So... will you end COVID now?,17
Ok Timmy… now show me again your dead hand move…,-1
Ha! I beat you one more time.,34
"Check what, now?",3
"What’s that new saying going around, “if Covid doesn’t kill you, checkmate will?” “",17
You hit a dead end kid,21
I enjoy the die-chotomy of chess.,2
"Clearly, you were playing checkers while I was playing chess.",56
"Now, let's talk about that sting.",-1
"Ha! You're move!  ...oh, wait, scratch that.",-1
It's 'The Seventh Seal' gambit! Checkmate!,-1
Checkmate.  Now YOU have to come with ME.,39
They booty popin,76
When your move may be your last #deathmatch,8
"I’m fully vaccinated and double-boosted, so it’s check and mate for you COVID death shadow",17
That's a move you will infinitely regret!,-1
"Hey, you Washington Square hustlers aren't so scary after all!",-1
Check mate!.  Now you can have my soul!,41
"How many times have you heard?
""I didn't see that coming""?",26
Chess or death,2
Ingmar Bergman’s Seventh Steal by Vladimir Putin,16
Oh you think you have all the killer moves...,8
What are you going to do about it?,-1
Sucks to be you!!!,-1
'Looks like I'll be taking my queen back!',6
"Die, muthafuckah!",-1
Checkmate…. You’re welcome to try again in 70 years but you’ve definitely lost your edge Old boy,35
I learned this move in a Swedish film!,49
Check-mate me and we’ll see who has the last laugh.,71
"Checkmate,nerd! You owe me $28!",-1
"Ha! Now, Jesus comes back or admit Prince was a mistake!",-1
If only my ex-wife could see me now! Chess is a useful skill!,2
"Human- You know this is a good metaphor for my stress. Playing chess against death. It's actually scientifically proven to-

Death- SELL SOUL.",2
Ha! Classic move from the Anti-Vaxxer Playbook!,17
"No, you haven't won. You Democrats don't know how this game works.",1
Now let’s talk Roe v. Wade,58
Checkmate! Sorry but I thought you were familiar with killer chess.,2
"And no, I'm not playing two out of three!",23
You know what? Enough. We’ve all had enough.,-1
"What you going to do now, Death?",53
"A surprising and potentially devastating move, but I’m afraid you’ve used up your time.",19
"It’s too bad you couldn’t play the fiddle, eh bud?",44
"That wins me immortality! Now, if I win the next game, I need you to get in touch with someone.",60
Checkmate in three moves is as certain as you and taxes.,38
Sorry. I know you're fond of the white horse.,62
Yahtzee! I win!,1
Looks like it’s time to pay the check…,-1
you clearly never watched bergman,16
"Clearly, I couldn’t possibly have cheated!",0
Guess it isn't really a game of life and death after all,4
I win. How about 'Risk' or 'Life' next?,1
"You might foresee my death, but you didn't see that checkmate, eh?",11
"Wow, this game is grim.",29
Finally I thought the Queen would die decades ago.,6
"Very nice.  But this works like the NBA, not the NFL.  It's best of seven.",-1
Told you white always wins!,27
"And, who’s soul do you have now?",50
"It was a good move, but we both know how this is all ends.",-1
"So, what do you think of your blue-eyed king now, Mr. Death?",7
Death shall have no dominion!,-1
Ha! Touchdown!,-1
"That's Expecto Patronum, I win!",1
HA! I win. As agreed now you HAVE to kill me.,1
Oops...I lose!,1
There's no way that I'll make this move. Do you think that I'm some sort of rookie?,25
"Checkmate, mother-reaper",86
"Sorry,Bruce,your time on the clock just ran out.",18
Why must you always play sudden death?,20
"Democrats to Republicans “we win- there will be not more sex ever for Republicans”

Would have been funnier it said by a woman!",-1
Caught you sleeping! Check Mate!,3
You talking to me? You talkin ta me?,83
Checkmate! Now payoff the bet and get to Congress before it's too late.,5
"Checkmate, Death! You were easier to beat than the IRS.",5
We all know how this is going to end but I’m making a bold move anyways.,19
You’re never going to win.,1
You fool! I’ve been playing 4D chess the whole time!,2
"You might be the Grim Reaper, but my chess skills are lethal.",2
No. You said no mulligans.,-1
"If you're going to make that move, perhaps you'd rather play dice with death.",8
Working these skeleton hands is getting exhausting and it’s so hot in this cloak.  Can I please take the hood off and set down the skeleton hands for a little?,14
Sorry but I can't give you a rematch right now.  I'm late for my life lessons podcast.,59
Checkmate! What are you gonna do about?,39
"Angel of Death, watch me change my fate, As I capture your Queen, and put you in Checkmate!",80
How does it feel to lose... your Queen???,6
"Checkmate. My soul 1, You 0.",41
"check again, mate",3
All those guys that chose the waiting game were real suckers!,4
See Death I can too cheat you,0
"It's not your turn turn yet, I'm still thinking about it.",-1
I don’t respond well to dares!,43
"I jumped all your pieces, now crown me!",-1
"I want permanent immunity from cigarette carcinogens and ten more good years of hair, or you’re going into check big guy",17
Check!! Also..I’ve never seen such a large N95! Are you immunocompromised or something?,17
So the last person you lost to was Bobby Fischer playing his final match?,68
"That's not a Queen, that's your King!",6
Can I tell you something? This table is killing my back.,-1
"I done told you once you son of a b*tch, I'm the best that's ever been",34
I finally beat Grimmaster!,-1
Check! Now fork over your socks.,14
And I am paying no taxes this year.,5
"Ah ha checkmate. Looks like the game is over for you Death! Oh no sir,the game is over for you",-1
"Sorry, but I don’t think you’re the right fit for our Bergman remake.",16
"Come with me, young man!.",32
I’ll show you checkmate,9
"So, this is how I die.",53
"'THERE IS ONE WAY TO WIN. DO NOT PLAY' whispered Death. ""I found that video of you online where you are wearing full bla..."" 'THERE ARE TWO WAYS TO WIN.'",1
Ehh I knew I should have picked connect 4 for this bet,13
Hope I wasn’t outta line with that crack about “Checkmate”!,9
"No, you don’t get 4 horsemen",62
I win! That means you owe me one million more Biden voters.,1
Google “En Passant”.,75
I knew bingeing Queen’s Gambit would pay off…,24
"Checkmate? No, you're checking out.",9
Now that you have mad that move it is checkmate and the game is over,38
"Be not proud, dirtball!",81
"Check, Matey!  And I'm dying to do this again.",3
It’s my turn and I can take a lifetime to make a move.,25
"Checkmate! So now you have to watch 'The Seventh Seal"" with me.",22
Checkmate - you're done,-1
Queen to Rook 5-now who's afraid?!,78
Give me the finger? Ha! Checkmate!!,12
Welcome to Sweden!,49
"With that opening gambit, I guess you are beatable",45
"I thought ""The Seventh Seal"" was metaphorical",22
I feel like I've seen this play before.,8
It's not everyday you beat death!,21
It's worth it!,4
Sometimes you're just a few moves away from the final price - be careful what you play at.,19
Check mate! What's your next move tough guy?,38
Don't get too excited. Your pieces go back in the box too.,-1
I thought you might have taken lessons after Bill and Ted humiliated you.,74
“That’s checkmate- and I think you owe me a scythe”,30
I  TRUMP YOUR PRINCE OF DEATH!,7
Do you think I care who gets taken? I just want the pieces gone.,-1
"Rest in chess piece"" (pardon the pun",2
You can’t win if I wanted to die first!!,1
Double or nothing.,46
Checkmate.  And try to be a good sport about losing.,31
I WIN. Now don't darken my door for another month.,1
"Nope, nothing in your teeth but
CHECKMATE!",64
"No, I didn’t agree to play for my soul. I said this was strip chess and we’re playing for clothes. Lose the robe, bonehead!",50
"Checkmate!!!"" / ""Sure! The winner takes it all",31
Now can I overturn Roe v Wade?,58
"All righty, I'm going to be wanting those goldfish back now.",-1
"I said, ""they're made from whalebone.""",76
Are you really sure you want to make that move?,25
And my horoscope said today would be an unlucky day.,42
"This time, the bishop comes for you!",28
"Checkmate, dude! Where's my new guitar?",-1
And they told me voting blue wouldn't work on you!,21
You can't have all of them.,23
"Checkmate, yet again. You just can’t cheat, Death.",-1
"Wow. Looks like you won. Unfortunately, you’re still going to die, but I’m glad you enjoyed yourself before you did.",1
Let's see you wriggle your way out of this one!,-1
"Check mate, Hah! The Grim Reaper always has the last move",36
Tag you’re it!,-1
No you can't eat my Queen,6
". “Let’s go 2 out of 3, shall we, old chap?”",23
"You win this one, but remember that we have another game to play in Samarra tonight.",85
Checkmate! Now give me my soul back.,41
Do you really think I am afraid of you? Clearly you haven’t been paying attention to what Republicans have planned for us.,-1
